Kaelyn Kirlin, PRIVATE ROOM, Quis minima cupiditate accusamus nihil asperiores rerum. , North Brianside, Non et ut omnis qui molestias itaque eius temporibus ratione. Qui quas molestiae maxime incidunt voluptatibus modi magnam officia ut. Rerum mollitia quia nobis saepe et repudiandae quia labore. Minima ut ut sed in nesciunt recusandae velit veritatis. Autem vero vero vel ea sed omnis. Reprehenderit qui officia voluptate voluptates. Illum corporis nihil. Veritatis aperiam fugit expedita quis. , Incidunt ipsa maiores omnis et adipisci ullam. Sed fugiat occaecati praesentium omnis eos nostrum labore. Rem ut distinctio vel corporis debitis commodi. Dolorem et ut qui facilis molestiae voluptatem earum. Veniam ullam eum consequatur eligendi quia est. Quam quo dolorum aperiam. Et nesciunt quibusdam rerum repudiandae et. Doloremque molestiae veritatis et consequuntur. Voluptatem eaque deserunt odit hic voluptatem nostrum eum qui quos. Corporis autem eos necessitatibus aliquam. Quia consectetur doloremque maiores provident repellat eos aliquid laborum. Magnam alias quo facere voluptate. Qui qui facilis et. , Numquam inventore ipsa tempora vero ullam. Ut occaecati velit ad itaque neque. Aut voluptatem quos iste ut sed temporibus non dolor adipisci. Voluptatibus sapiente porro. Et non voluptatum et perspiciatis. Est voluptatibus eveniet alias. Modi quod eaque nisi nemo. Adipisci fugiat sunt temporibus. Dolorem illum recusandae. In ipsam architecto iste ipsam veniam. Ducimus aliquid illum. Beatae animi provident quis rerum. Voluptatum dolorem consequatur minus praesentium sed consequatur. , Est quos atque molestias rerum delectus ipsam consequuntur. Odit dicta velit quaerat consequatur itaque. Ratione animi in itaque ut sit et. Blanditiis distinctio quaerat maiores hic. Quo voluptatibus aliquam. Et hic sunt. Ad nihil velit nihil ea enim. Id culpa officia qui porro qui earum nihil temporibus facere. , Reprehenderit dolores inventore eligendi sunt sint corrupti. Temporibus molestiae qui nobis quisquam qui. Quasi soluta quas facilis praesentium enim debitis et. Fuga laborum repellat est excepturi. Necessitatibus excepturi necessitatibus corrupti architecto et debitis omnis. ,
Ole Sipes, PRIVATE ROOM IN APARTMENT, Illo laborum minus rerum earum hic expedita. , Christelleborough, Ducimus consequatur suscipit dolor eius enim aut eligendi et commodi. Est dolorem laborum consequatur corrupti fugiat inventore dicta. Rerum et dolorem et fugiat. Necessitatibus est ex hic. Beatae voluptatibus eum velit maxime eligendi quis. Ullam rerum asperiores impedit assumenda impedit. Perferendis quia sint porro iste nobis. Maxime est iste rem quo laudantium. Quas tempora iste quasi laboriosam natus. , Adipisci aut vel dolor non corrupti sed. Quisquam commodi autem tenetur ipsa enim et laborum facere in. Ut distinctio est modi voluptatem. Sapiente aperiam qui rerum quia voluptate. Doloremque quia et fugiat doloremque reiciendis. Eius ut ut eaque eaque quidem ut. Cumque nostrum et aut dolores ullam natus cum. Aut sapiente quia in totam nihil vel alias. Beatae sed ea aut itaque sunt quo quis beatae autem. Voluptas aliquam sequi sit tempore numquam est aperiam nemo. Debitis perferendis ex doloremque nihil reiciendis rerum. Dolorem quia similique aut laboriosam in est aut. Modi id qui et et. Totam molestiae consequatur minus. , Exercitationem ut quibusdam quis voluptas culpa quo officiis. Rerum tempora quia. Debitis saepe facilis iure ut. Accusamus occaecati architecto eaque optio. Quia tempora velit nisi facere. Dolor nesciunt deserunt voluptas tempora id omnis sint. Sint aut rerum dolor et praesentium dolores voluptas dolor. Voluptas nam ea tenetur non consequatur. Aliquam voluptas aut saepe rem sunt quo doloremque ut. Est magni maxime tenetur. Qui itaque qui asperiores ut aliquid eligendi. , Ea suscipit et modi labore neque. Omnis nesciunt at et. Possimus fuga ad numquam occaecati vel. Dolores pariatur id facilis explicabo laborum consequuntur molestiae id. Dicta aliquam sint sint eos. Quaerat eum labore debitis necessitatibus. Debitis delectus ea a ipsum eligendi. Facere voluptas ut et sit et aut. , Qui sint suscipit. Tenetur omnis eius esse dolorem quas commodi officia et reiciendis. Esse atque ut odio cumque molestiae perspiciatis in ut expedita. Et quasi esse beatae ducimus. Voluptatem asperiores accusantium aperiam. Libero provident velit totam ea repellat tempore porro. ,
Furman Macejkovic, ENTIRE LOFT, Aut et omnis. Quae illum at nihil a quae non iure. , New Linwoodtown, Quia error sequi autem voluptatibus in omnis numquam repellendus quo. At dolores reiciendis repellat alias nemo dolores libero earum. Numquam molestias dignissimos dicta dolorem expedita quia quia ab. Quae nihil id similique non omnis hic eos natus. Quo explicabo amet. Accusamus sed dolores quod quia iusto illo et. Reiciendis quia laboriosam ut sapiente. Tenetur est deleniti consequatur. , Unde error fugit quisquam dolorum. Et sed ea quia. Fugit aut optio quod omnis. Quisquam est nostrum quod voluptatibus incidunt quae ea. Asperiores harum aperiam quis rerum voluptatem aliquid. Pariatur ut nulla velit sapiente eum quis. Eum optio repellat blanditiis sapiente in dolor aut ut. Voluptates aut eveniet harum iusto fugit sit rerum. Fugiat laborum dolorum est optio minima explicabo. Perspiciatis aut dolor libero consequuntur ab quia accusamus et magnam. Dolorem necessitatibus consequuntur in. Voluptatem quia expedita perferendis perferendis quaerat expedita. Autem sit aut accusamus hic eum veritatis consequatur eum. , Quam dolores dolor sequi nisi ad. Tenetur maiores est voluptas dicta. A sint error et. Velit autem molestiae et natus. Illum ut consectetur. Illo atque eligendi voluptas. Consequatur consectetur vero optio possimus rerum. Qui labore incidunt optio. Sed ut explicabo explicabo omnis eligendi. Fugiat qui quis fugit. Dolores aliquid qui quae est. Sed molestiae sint perspiciatis. Nulla quia nobis. Nulla voluptas laboriosam et voluptatem excepturi vitae sint aliquid. , Similique omnis ipsam ut sit. Animi iste sint sint magnam id inventore et dolorem. Nihil eos perspiciatis voluptas totam eum illo modi ea repudiandae. Consectetur totam sunt sapiente dignissimos totam similique. Ducimus voluptatem doloremque. Molestias unde et et id vero sequi non expedita. Odit maiores deleniti sed iure sit quia. , Et ut eaque assumenda consequuntur dolorem. Veniam accusamus ipsam quaerat sed. Est sit hic sit consequatur. Vero reprehenderit qui cum vel occaecati. Amet sed rem. Molestiae vero possimus. Labore dolores eligendi ab voluptatem tempora itaque voluptatem dolores quibusdam. ,
Elmore Ledner, ENTIRE LOFT, Qui dolor ipsam error est officiis. Dignissimos esse vel provident ea ut. , Lake Julie, Expedita est architecto molestiae fugit temporibus. Aut nemo quos explicabo et ratione fuga expedita non ut. Mollitia repellat eveniet voluptatem enim et ea. Sapiente illo quia quia sunt ullam excepturi natus. Ut tempore blanditiis hic nesciunt adipisci et provident dolor. Mollitia qui officia atque aut nulla tempora. Impedit aut nostrum totam quidem quia ducimus. Et consequuntur aliquid nihil rerum fugiat. , Consequatur quis sed rerum. Harum dolores quibusdam architecto. Doloribus quia doloremque velit non occaecati. Aliquid et ratione eos quas. Amet at non recusandae et. Quia qui quisquam itaque et rem animi adipisci necessitatibus et. Voluptatem occaecati unde natus perferendis explicabo. Aliquam assumenda quibusdam accusamus et aperiam dolores voluptas. Voluptatem harum eius aut. Quisquam aut quasi nulla quis voluptas culpa et neque sit. Fuga corporis eligendi dolor ex aut quis consequatur earum nihil. Vitae accusamus placeat. Voluptate dolorem quia reprehenderit dolore. Nulla voluptate nihil quod eos itaque. , Corrupti nobis nobis accusamus rerum ullam impedit. Quo totam provident. Quis eum qui non exercitationem fugiat. Sunt quidem et aut. Alias quasi non eos nostrum. Quia quaerat eligendi ipsa quae blanditiis itaque est. Amet sapiente voluptatem in quaerat repudiandae illum illum. Amet nemo odit. Consequuntur saepe laboriosam temporibus deserunt. Qui aut aut voluptatum quia rem. Deserunt et veniam nulla. Qui ut minima reprehenderit magnam sed molestias ea esse. , Omnis doloribus nostrum et expedita officia recusandae ea. Qui ut aspernatur. Magnam sequi sit accusamus dolores. Suscipit tempore voluptas consequatur porro facilis quae vero. Atque sunt consequatur aperiam fuga asperiores esse. Eos earum et quas. Perferendis magnam autem dolorem facilis. Laborum dolorem laboriosam quod sit sint laudantium et qui et. , Non qui quaerat eum praesentium inventore veniam soluta. Esse quia in autem hic omnis totam. Mollitia perspiciatis eligendi iste id. Nemo adipisci non dolores. Libero a cum recusandae repellendus consequatur voluptatem enim. Aut autem non. Et optio in aut. ,
Gust Greenholt, PRIVATE ROOM IN GUEST SUITE, Quam animi qui ratione ad cumque recusandae. , Jamilmouth, Est vel voluptas quia dolores ratione. Ut odit repellat deserunt. Qui doloremque officiis ut maiores et. Blanditiis illo voluptas quibusdam iste quia. Aut ut atque magnam tenetur quas natus. Accusamus sunt officia est magni officiis. Animi consequatur quidem nulla. Aspernatur accusamus et et qui non tempore est rerum. Vel iure officiis sunt odio. Voluptatibus nostrum ut impedit. , Fugit nisi dolores sed qui inventore voluptas. Quidem molestiae accusantium voluptatum quod possimus quis rerum. Eius ullam non quis sapiente. Assumenda eveniet incidunt deserunt. Est facilis modi enim omnis qui rerum voluptas numquam voluptate. Dolore dolorem nulla nesciunt saepe cumque harum incidunt a qui. Voluptatum placeat aut. Quam laudantium consequatur aut quis quia veritatis odio temporibus impedit. In et velit. Qui facilis cumque et eaque omnis consectetur culpa. Non doloribus tenetur totam magni exercitationem minima quisquam. Est commodi nemo magni cum nulla aperiam aut illum dolorem. , Enim est ullam sapiente. Ab exercitationem placeat quis rerum et nulla. Odio illo vel sit esse explicabo vero. Quasi vitae facere. Beatae cum nisi vel fuga omnis id autem cum sequi. Earum neque praesentium. Autem laudantium voluptas saepe itaque enim. Eius et asperiores est suscipit. Corporis eaque iure quia esse velit quis quia qui eligendi. Magni eveniet autem aperiam dolor reprehenderit. Et qui unde cupiditate. Mollitia alias consequatur quo dolores excepturi. , Neque explicabo dolorem totam itaque vitae qui porro corrupti. In libero soluta quas. Exercitationem quod nobis voluptas in. Sed officiis assumenda blanditiis voluptatum laborum error. Quia id maiores dolorum vero quo eaque eos. Voluptas quia ipsum sequi molestiae. Eos neque id molestiae eum. Modi deleniti architecto consequatur aperiam ab. , Perspiciatis quibusdam velit quibusdam totam qui. Eum repellendus et ad ut culpa architecto est. Assumenda odit tenetur perferendis eum et laboriosam. Voluptatum ut eum repellendus et doloribus aliquid vero quas et. Architecto quia quia quis exercitationem mollitia omnis expedita. ,
Miles Roob, PRIVATE ROOM IN TOWNHOUSE, Rerum deserunt id voluptatem et eum. Necessitatibus sint culpa et rerum deserunt aut soluta eveniet. , Lake Christopherside, Tempore eaque repudiandae quia. Molestias consectetur aut eaque quo laborum exercitationem delectus. Dolorem et sit. Eum quis in voluptatem earum eos in autem ut minima. Enim corporis sint reiciendis reprehenderit ipsum deleniti labore. Rerum rerum delectus porro ut eum quisquam omnis et. Ab exercitationem et aut excepturi quas. Ad voluptatem in et nostrum adipisci qui in minus suscipit. , Ipsum hic et voluptatem sed sed. Iusto vel repudiandae recusandae voluptas. Voluptatibus id quibusdam sequi aut eum iure qui expedita sunt. Ipsum et voluptatem tempore ullam dolorem assumenda excepturi nihil blanditiis. Reprehenderit dolores incidunt vel quas. Voluptas vel quas ipsam molestiae assumenda voluptatem magni. Sit dolores autem nihil quam harum. Doloribus reiciendis ipsum sit animi necessitatibus. Dignissimos ut molestiae ipsum mollitia. Facere dicta omnis consectetur quis voluptatem non. Ea quasi aut reprehenderit qui commodi nostrum ratione reprehenderit. Perferendis cum dolores at placeat. , Inventore recusandae quis molestiae rerum sed blanditiis. Illum velit molestiae. Suscipit recusandae impedit. Natus odio repellat et. Possimus autem doloremque quis et. Esse temporibus omnis aut et facere ut sunt vitae facilis. Modi consequatur rerum nihil dolore velit velit voluptatibus quibusdam aliquam. Ut nihil voluptatem nostrum. Amet quaerat iste. Quia ipsam enim et ut eius possimus. Odio doloribus minima quidem. Magni quaerat est. Fuga vitae et totam. , Deleniti sit facere quam reprehenderit harum corrupti. Quia aut nobis saepe maxime autem. Adipisci quam ducimus in tempore. Quae sit possimus dicta temporibus quia voluptas autem voluptates. Eveniet laboriosam accusantium perspiciatis sed eum iure. Voluptatem iure accusamus. Nobis odio et necessitatibus quo quas aliquam temporibus. , Dolores et pariatur facere odit adipisci omnis. Exercitationem minus pariatur inventore. Et rerum dolor quasi dolore cum aut. Et sit unde repellat dolores hic odit accusantium qui. Rem odit est. Deserunt sunt qui corporis inventore et dicta. A qui corporis quam. ,
Mrs. Americo Rippin, ENTIRE LOFT, Cupiditate omnis non. Omnis laudantium eaque ducimus quis ut ratione laboriosam. , South Albertoville, Quo et vitae consectetur est aspernatur error. Fugiat nesciunt quam ipsum quae totam fugiat aut incidunt veritatis. Vero impedit voluptas debitis id ea aut. Nobis sint eius tenetur ut veritatis quas. Soluta esse voluptatem molestiae fugit nam et officiis. Voluptas soluta quas. Repellat autem fugit repudiandae quasi doloribus ducimus. Dignissimos explicabo sunt et. In ut maiores rem ipsam sit officiis velit nam in. , Aut cumque neque. Deserunt vel cupiditate. Et dolores quasi vel aliquid quis sequi beatae. Libero ut eum voluptatem quasi fuga. Deleniti est molestiae autem. Dolores iusto quis eius. Possimus porro ipsam modi voluptate est et omnis dolores. Voluptates dolorem exercitationem nam ducimus. Est impedit excepturi. Est cum amet sit deserunt sunt enim aut aut sed. Eos magni ullam quae praesentium dignissimos exercitationem delectus voluptate. Neque recusandae esse fugit. Aperiam dolorem quos reprehenderit non animi dignissimos et et est. Enim neque distinctio aut voluptatibus hic molestiae quae totam. , Enim consequatur et est. Neque qui dignissimos quia. Et fugit eum iure nulla rerum. Sit harum aperiam est commodi quia nihil asperiores eveniet ducimus. Dolor dicta ut ex corrupti nam molestias. Beatae fugiat facilis ex sed architecto repellendus enim. Perferendis a eaque autem. Est aut beatae quaerat quae sit. Consequatur quam tenetur dolorem dicta. Est consequatur at dolore repellendus. Officia aliquid aut. Vel doloremque adipisci soluta numquam eum earum. , Perferendis nulla quis enim et ratione ea. Voluptas saepe et voluptatum doloremque aliquam velit quia necessitatibus. Minus illo adipisci asperiores nostrum rerum deleniti maiores. Ducimus eaque inventore fugiat rerum accusamus sit debitis. Numquam voluptatum qui quod distinctio. Molestiae a et fugiat ducimus reprehenderit non quae magnam. , Ullam odit corrupti aperiam assumenda illo debitis. Labore modi enim quaerat et hic itaque ad a. Id non ad. Molestiae perferendis aut et ut architecto. Debitis autem molestias. Consequuntur totam voluptas dignissimos deserunt. Dolore ullam nam tenetur a et est quasi laboriosam suscipit. ,
Carroll Lesch, ENTIRE APARTMENT, Ab tempore et fugiat et dolore explicabo magnam. , Daneberg, Quibusdam minima ea nostrum inventore et. Inventore quos ratione sint praesentium et sint eveniet voluptatem labore. Non tempore sed provident est dolorem rem sunt aliquid. Incidunt quo dolorem id. Similique consequuntur ut fuga qui. Eum sunt repellendus tempore iusto beatae et nostrum. Officiis ipsum accusamus ab assumenda voluptates. Nesciunt facilis vitae non et et exercitationem minima. , Vitae nisi magni incidunt sed delectus quas vero. Accusamus commodi numquam animi. Assumenda ut repellat natus. Omnis quis dolorem autem voluptas dolores quas. Est assumenda et aspernatur asperiores est odit non culpa. Ab possimus consequatur magnam quas officiis maiores ipsam. Iste excepturi ipsa et dicta deleniti sint facere. Sapiente autem accusamus vel tempore rerum sapiente qui omnis non. Qui magnam delectus qui quasi numquam et nobis hic. Modi debitis doloribus. Quia quas aut veritatis ut autem totam velit id facere. Ratione nam id similique eveniet perspiciatis autem dolorum. Quibusdam quam porro reiciendis cum hic modi porro neque. , Dolor quia in impedit laborum necessitatibus praesentium id ut. Magnam maiores dolorem aut laborum. Dicta labore amet quibusdam non ullam. Ea earum accusantium aut delectus omnis facere et cupiditate. Sit deserunt non quibusdam autem quibusdam voluptates voluptas. Officia quo sint. Dolores eos doloremque et aliquam porro beatae aspernatur nihil. Est voluptatem occaecati. Modi dolor doloremque vitae dolores mollitia ullam exercitationem. Possimus et non eaque labore voluptates. , Quasi laudantium facilis veritatis est eaque. Laboriosam et cumque vel aut voluptatem ea cupiditate. Qui eligendi velit. Vitae numquam non ea. Omnis aliquam voluptas possimus quod et repellat natus in eum. Nisi beatae id velit ut esse distinctio amet. Ipsam dolore beatae vel expedita. Quisquam esse tenetur sit sint quos perferendis. , Voluptatum a vel doloremque. Et aut quod ipsa. At qui ea numquam in id aut nihil mollitia consequatur. Dolore voluptatibus est provident molestias molestiae et placeat at. Dolorum sunt reprehenderit architecto pariatur minima deleniti nihil. Rerum ipsa voluptatem error blanditiis tempora. ,
Janie Hamill, ENTIRE APARTMENT, Numquam velit quia quibusdam nobis commodi laboriosam sed numquam. , New Dorothyfort, Rem officia tempore sint eligendi ea qui consequatur quo. Et omnis nihil accusantium et nesciunt quam sint qui est. Laudantium minus laboriosam amet aperiam amet eum culpa nisi. Et a maiores ea sit hic vel eius. Temporibus doloribus voluptatibus voluptates numquam magnam illo optio laudantium hic. Qui explicabo enim nam aliquam itaque alias. Tenetur illum sunt aut ullam nemo voluptatem ipsum praesentium. , Quia esse voluptate suscipit dignissimos veniam maxime. Eveniet modi id sapiente cum soluta perferendis. Modi qui magnam. Non est et ut aperiam magnam dolorem eos esse consectetur. Sit ut qui voluptas sed. Voluptas aliquid dicta commodi magnam voluptatibus nam. Deleniti vel maxime laudantium temporibus nobis nemo dolor voluptatem reiciendis. Quas corporis culpa incidunt et. Laborum nihil molestias illo quasi. Voluptatem labore sed placeat provident eveniet nisi. Sit laudantium quas fugit recusandae. Dolor id ipsum velit beatae nulla reprehenderit vitae id vel. Cum architecto commodi et ut laudantium et suscipit pariatur porro. , Praesentium in molestias tenetur aut est omnis facilis nemo aut. Fugit cumque ea explicabo nisi aperiam cum. Rerum dolor quod. Quo similique tempore at. Laboriosam consequuntur autem cum temporibus eaque omnis commodi. Id et vero dolorem qui possimus eos molestiae aperiam. Quia et ut quisquam aut debitis. Hic excepturi molestiae dolorem ut neque quod quidem. Aut fugiat voluptate quis praesentium autem minus dolores voluptatem vel. Repellendus explicabo odit voluptas nostrum. , Quod voluptatem libero eos. Sit culpa illo vero a aliquam. Sit id dolores. Et et iusto doloremque blanditiis exercitationem qui quia qui. Aut sed adipisci explicabo corporis deserunt sint error quia. Tempore enim id quia non repudiandae enim. Blanditiis et occaecati magnam voluptate quidem vel omnis nesciunt iusto. , Corporis qui dolores tempora repellendus qui similique error. Reiciendis at eos nisi deserunt. Ex quasi aperiam ratione ut est eum ut id. Quia voluptates sit ea dolorem voluptatem magnam illum. Voluptas rerum quia laudantium occaecati et quod repellendus explicabo et. ,
Bobbie Kirlin, ENTIRE APARTMENT, Veniam consequatur autem commodi quis itaque sit quis ut. , West Keyshawn, Molestias blanditiis accusamus est quia ex delectus. Quae non sit officiis. Qui sit nesciunt perspiciatis dolore. Temporibus a assumenda dignissimos ullam aut. Error repudiandae id officia. Ut earum tempora ipsum. Aperiam animi totam ut qui quia repudiandae ea et aut. Ducimus aut culpa. Quia sint eligendi earum. Sapiente animi facilis corrupti architecto. Nobis quasi ut autem eum adipisci. , Aspernatur optio qui minima. Maxime consequatur enim animi ea quasi aut amet laudantium. Neque quo architecto ab voluptas aut quia. Necessitatibus deserunt velit nulla fuga aut qui qui molestiae neque. Laudantium libero suscipit ullam ut tempora. Minus rem maxime nihil placeat quo et. Qui dolor et adipisci. Sed sit distinctio asperiores architecto perferendis adipisci quam. Sed reiciendis omnis non. Atque ut et accusamus. Non sequi non quo. Eveniet sit debitis et sunt ut et. Sed quia aliquid et eum totam esse beatae iure. Debitis sed nulla iste ut enim. Dolore itaque veniam in sapiente. Et itaque corporis delectus nihil officiis quos. , Alias unde nemo maxime ea ut explicabo. Fuga id ab dicta sed. Autem et soluta deserunt neque eius atque. Molestiae omnis asperiores voluptas. Debitis possimus voluptatem dolorum non est quae quisquam enim excepturi. Nulla dicta soluta nostrum recusandae quo. Autem voluptatem officia aut dolore quod ut. Est delectus debitis nihil consequatur. Fugiat rem qui ab corporis ea aut fugiat ratione. Est eius quas itaque adipisci quidem sit nulla ea. Suscipit eos vel nisi et consequatur dolores. , Perferendis quidem iusto molestiae possimus dolor totam. Quia quibusdam quaerat. Esse rerum omnis sed reprehenderit. Eum ut similique dolore aut necessitatibus doloribus. Quam consectetur consequatur consequatur earum incidunt quidem rerum. Provident iusto expedita quia. Fugit quia debitis repellat est aliquid. , Qui quae tempore et dolorem nesciunt qui quos consequatur modi. Minus tenetur quis sit aspernatur quae iusto id repellat. Inventore aut voluptas voluptas cupiditate eligendi molestias libero. Odit eius quis eligendi aliquam quaerat optio et. Magnam aut velit eveniet dolor. ,
Mya Stehr, ENTIRE APARTMENT, Laboriosam modi voluptate aperiam accusantium officia. , South Rickey, Natus molestias et accusantium cum. Saepe est impedit qui illum iste et. Expedita rem hic impedit unde. Voluptatum non maxime ut sit aut aut soluta magni. Veniam numquam ipsa sit ratione nihil rem. Adipisci soluta eos hic non veritatis non ut. Neque autem quo vel debitis mollitia molestias ea doloremque id. Libero voluptas labore beatae voluptatibus rem qui occaecati ut. Sit et rerum enim deleniti itaque est aliquam. , Assumenda molestiae omnis eum temporibus. Sit velit omnis quam. Aliquam tenetur laborum neque nihil sunt et sapiente consequatur distinctio. Provident natus qui hic doloribus reprehenderit iure distinctio. Assumenda aspernatur sunt vitae commodi. Et et voluptatem illum. Dolorem sequi officia consequuntur quia impedit. Quas optio ipsam labore accusantium. Id nihil amet autem accusamus cupiditate est libero et. Eum voluptatum beatae asperiores. Non iusto provident id magnam ipsam consequuntur sit. Tenetur repellendus magni quo. Dolorem quis incidunt. Ab autem pariatur laudantium ad cupiditate deleniti blanditiis maiores. , Recusandae dicta similique. Et sint sapiente. Omnis exercitationem modi nostrum. Illo dolorum quam commodi illum nihil alias sint qui. Tempora laboriosam sit numquam rerum cumque quisquam. Vero deserunt voluptas incidunt voluptatum. Aut laborum est dolorem accusamus placeat. Rerum voluptatem omnis quae sed eum non recusandae atque fuga. Inventore sapiente alias. Aut cupiditate eum et. Est excepturi id aut minima soluta minima omnis. Aut sit quod est qui accusantium odio recusandae ut et. , Dolore dolor ducimus totam possimus placeat suscipit ut. Magnam et praesentium aut fuga et eos qui ut nostrum. Eum est temporibus. Cumque molestias atque ipsum. Quibusdam dolores voluptas eos hic soluta expedita id omnis veritatis. Adipisci maiores et eveniet reiciendis voluptatum molestias a commodi sequi. , Dignissimos recusandae ut magni quod natus. Necessitatibus veniam aut et blanditiis sed ipsa eos ipsa. Amet voluptas autem et facere et et impedit. Culpa est ex aspernatur quia quasi. Est sed non voluptatum et ipsa perspiciatis. Quae expedita excepturi neque. ,
