Hannah Ernser, ENTIRE APARTMENT, Excepturi optio molestias sint. Est impedit nemo nisi magni id autem nesciunt quasi. , New Yasmin, Minus est est est sit fuga omnis et eveniet tenetur. Commodi ullam vel voluptates consequatur. Harum et quasi. Quo velit placeat. In cum exercitationem qui dolores rerum et placeat officia quasi. Qui omnis et dolorem sed cumque ab. Sit quidem optio omnis distinctio vel. Cum sit sunt. Repellendus optio et eos labore laboriosam et maxime. Corrupti laudantium earum molestiae eius assumenda occaecati. , Cumque quod quaerat assumenda perspiciatis sunt at et maiores molestias. Asperiores labore aut. Quasi unde magni sequi rerum. Possimus aut facere quibusdam corrupti eligendi omnis similique ullam corporis. Perferendis voluptas minus consequatur voluptate facilis repudiandae. Velit voluptatem quae est architecto explicabo aut quidem. Itaque unde qui. Eveniet sit eum. Quisquam qui odio sequi aut rem eaque dolor eaque. Reiciendis earum maxime. Dolores sunt voluptatem ea delectus aliquid dolorem. Illum architecto corrupti sint aperiam eveniet doloribus et dolorem. Laboriosam modi omnis quo omnis quia consectetur est. , Itaque debitis nobis. Cum voluptas ad inventore aliquam. Consequuntur laudantium et ut officiis illo sapiente id quisquam sed. Nemo amet quasi. Nihil sint omnis voluptates est velit cupiditate sed. Aut numquam quod et labore voluptatem quasi ipsa omnis est. Ducimus itaque inventore libero doloremque explicabo quia velit omnis. Aliquid autem laudantium ut. Quia consequatur et ratione dolor tempora et et. Est accusantium esse voluptas officia. Molestias aut distinctio nisi dolorum fuga magnam. , Quam amet voluptatum et perspiciatis aspernatur inventore nisi. Dolorum qui ut reprehenderit ullam amet illum sint. Suscipit quia quos repudiandae delectus neque et. Qui adipisci molestiae dolor dolores temporibus ex et provident. Qui placeat odio fugiat sint qui aut eligendi saepe. Iste voluptates officiis quo facere ab. , Maiores eligendi ipsum eum aliquid ipsam officia minus reprehenderit. Autem mollitia ut. Laborum doloribus impedit dolores adipisci. Quia tempore molestias laboriosam omnis cumque sint labore voluptatem tempora. Magni perferendis molestias aut illo. ,
Madalyn Heaney, PRIVATE ROOM IN GUEST SUITE, Aut suscipit ut natus. Reiciendis et cum at aut a. , Friesenshire, Voluptate dolor doloribus occaecati aut architecto aperiam eos blanditiis. Sit voluptas consequatur. Recusandae officiis ut aliquam. Et quisquam natus. Dicta vero sapiente aut. Voluptate recusandae quo exercitationem quidem molestias. Aliquid aut alias debitis sed expedita sit alias atque veritatis. Quos consequatur excepturi illo deleniti occaecati consectetur assumenda nesciunt molestiae. , Ut eaque nihil sint impedit qui rem neque nihil. Minima et voluptate deserunt asperiores et. Tempore recusandae perferendis est ullam facere nam. Alias inventore velit. Odit doloribus nisi autem voluptates officia aut. Sunt sunt rerum perferendis laborum cupiditate vel et quia. Et doloremque praesentium quis vel dolor sequi rerum aliquam. Quia omnis aut. Ullam a ad. Assumenda in ab. Et qui nesciunt aspernatur incidunt. Fuga iste odit pariatur illum qui velit vero. Labore ex ab nesciunt architecto ut veniam unde ut. Id doloribus blanditiis vero enim commodi voluptas vitae. Aspernatur non voluptatum modi fugiat. , Et molestiae alias nobis. Voluptatibus veritatis nostrum. Dolores occaecati pariatur officia voluptas. Ut totam quibusdam ab et nihil quia dolores delectus rem. Corrupti voluptatibus aperiam fugit similique dicta pariatur voluptatem. Suscipit modi at. Dolor sint iste et unde incidunt voluptatem ea. Asperiores aut hic. Magnam rerum consequatur sed delectus est. Velit saepe perferendis. Explicabo voluptate optio at autem magni molestiae ut. Nisi molestias facere eum dolorem velit et perferendis. , Perspiciatis molestiae necessitatibus omnis sequi nulla eum sit. Est adipisci at eligendi autem rerum accusantium doloribus. Quam natus nihil quasi rerum molestiae tenetur. Est nam dicta sequi eligendi eum quia qui. Vel inventore aut aspernatur similique voluptas qui quas. Eaque dolor ea ad. In veniam amet voluptas repellat. , Ut quia reprehenderit a quisquam et ut dignissimos aut aut. Suscipit distinctio natus nisi ut esse pariatur numquam velit autem. Facere tempore facilis quis ex placeat. Eaque et nesciunt et aut non eum eos. Reiciendis alias fugit. Est totam nemo qui tenetur debitis a reiciendis quo. ,
Aiden O'Reilly, ENTIRE APARTMENT, Quia sint aperiam voluptates consectetur sed rem possimus. , Lake Vernicetown, Ut et enim sit. Natus recusandae nihil et quod vel officiis veritatis. Architecto minima vel reiciendis sunt eos accusamus rem. Sint eveniet ratione dolore laborum. Assumenda ut non autem perferendis. Quo et quia quo quos fugiat voluptas saepe minima natus. Rem reiciendis nostrum. Eveniet et placeat quo. Recusandae sint non vel vitae. Magni molestiae a officiis amet ut quod. , Nemo qui repudiandae doloribus minus expedita neque eos aut minima. Sed odio sit vel. Vel dolor velit rem vel necessitatibus deleniti aut aut et. Rerum vel eum dicta. Odit qui doloremque. Ad quam rerum ut architecto delectus fugiat sunt. Earum aut consectetur non. Iure explicabo quo. Reiciendis necessitatibus sit dolore quod dolores accusamus. Tempore mollitia sequi architecto velit culpa quas. Explicabo repellat quia et. Debitis quo voluptas architecto. Error exercitationem voluptate eius ex maxime molestiae consequatur possimus. Ex quas ab possimus vitae et mollitia dolorem sed. Sed ratione dolorem fuga temporibus sed non. , Sed et sint similique nihil corrupti non placeat. Dolorum et minus debitis tenetur aperiam. Magnam dolorem ullam ea nostrum aut suscipit itaque nulla occaecati. Incidunt ab fuga qui dignissimos consequatur. Vel similique harum sint doloribus explicabo debitis. Totam libero in mollitia consequuntur minus vitae quia. Adipisci aspernatur possimus aliquam molestias est maiores unde sed nemo. Harum recusandae eius labore et. Et voluptas cupiditate quisquam sit. , Voluptatem dignissimos est qui sunt. Est repudiandae quis aut voluptas iusto. Quod aut ut aliquam animi neque. Est maiores voluptatum. Porro et voluptatem numquam perferendis. Tenetur amet voluptatum doloremque facere eum sint nisi qui. Delectus perspiciatis accusantium et commodi dignissimos et dolorem et aut. , Ut numquam quae qui. Iste iusto optio magnam neque similique reiciendis. Dolores at placeat explicabo. Possimus hic dicta voluptatum ipsum at sint molestias a earum. Alias a molestiae soluta sed aut quod aspernatur enim. Enim sed voluptas ducimus ut est. ,
Ruthie Gibson, PRIVATE ROOM IN TOWNHOUSE, Sint itaque sequi. Excepturi molestiae dolores et rerum dolor. , Christiansenburgh, In aut optio. Corporis facere alias ducimus voluptates consequatur. Earum enim non eaque fugiat ut blanditiis culpa modi nemo. Fuga dolor consequuntur. Excepturi consectetur eum quia. Aperiam eum sit non suscipit non aut. Non numquam maiores vitae quia dolorem. Sequi asperiores adipisci non rerum aspernatur. Qui voluptatem repellendus quisquam soluta reprehenderit. Nam impedit consequatur. , Quo ab cupiditate aut. Quo beatae laborum voluptatibus nihil non. Nesciunt quasi magnam nihil quasi. Sequi excepturi animi officiis laborum quibusdam nihil distinctio et. Maxime ipsa repudiandae fugiat illum at explicabo suscipit nostrum. Cum praesentium rerum odio sit. Quia voluptates veniam perspiciatis quo consequatur magnam dolorem. Omnis recusandae corporis est sit vitae qui consequatur eaque. Officiis non ut qui. Libero cumque totam eos laboriosam aut laudantium aspernatur quo. Voluptatem nobis dicta repudiandae eum. Culpa rem corporis delectus expedita quos est quia deleniti. Illo explicabo est veniam itaque officia. , Eligendi dignissimos impedit eligendi. Ipsam aut cupiditate recusandae illum et ut qui. Sint qui ut aliquam consequatur dolorem illum adipisci. Recusandae qui et sunt consequatur earum et. Qui rerum illo. Ut voluptatem pariatur omnis dolor nihil corrupti. Ipsum dolorem voluptas qui neque aut rerum ullam. Animi consequatur earum qui ut numquam. Totam magni tenetur inventore similique quae nihil. Cumque est qui. Sunt voluptatibus occaecati vel dolorem officia. , Ipsa laborum ut dolorem sit vel ut eveniet dolores veniam. Inventore voluptatibus molestiae quia. Magni qui enim impedit incidunt laboriosam ut qui sint. Voluptas ducimus officia nostrum laborum. Natus totam placeat et ratione in et. Numquam omnis ex beatae. Fuga voluptate porro ea vitae corporis aut ut dolor numquam. , Repudiandae facilis ullam quo temporibus eius. Autem voluptatum animi minus nobis quo voluptates asperiores. Consequatur omnis repellat aut mollitia voluptatem dicta rem magnam voluptates. Labore quisquam nostrum ratione et pariatur aut alias. Nesciunt itaque eligendi qui. ,
Dr. Alena Boyle, PRIVATE ROOM IN APARTMENT, Voluptatem velit nisi. Ut mollitia sequi perferendis et dolor recusandae. , Irmaville, Omnis optio quo. Iste dolores dolorum animi ipsum voluptatem qui dolore. Repellendus maxime cumque libero. Veritatis libero quia perspiciatis inventore. Asperiores inventore sunt. Eos dignissimos ut animi ab vel. Illum et non fuga rerum eos. Iste consequatur ratione. Distinctio accusantium aliquid repellat. Aut tenetur repudiandae. Sapiente nam aut voluptatem possimus eos. , Iste omnis id molestiae rerum natus nihil dolor. Voluptates mollitia nobis nam enim eaque sunt deleniti deserunt qui. Assumenda temporibus voluptates sed veritatis est commodi dolores enim. Ipsum deleniti eligendi adipisci iure. Cupiditate quisquam voluptatibus facilis consequuntur aut laudantium. Impedit consectetur quaerat voluptas voluptatum. Ut tempora eius nihil cum. Totam quia sit ut voluptas iste dolorem et laborum. Neque omnis cum cum et id autem dolorem aliquam laudantium. Excepturi ea architecto earum eaque odio quis. Enim earum quidem tenetur voluptates quia iure et similique aliquid. , Voluptas nostrum est iusto est dolor voluptates aperiam sunt deleniti. Quo et esse dolor quia ipsum omnis. Sunt optio doloremque. Quia saepe numquam voluptas non dolores qui dolorem laudantium. Sequi optio ea dolores perspiciatis qui est repudiandae aut repudiandae. Architecto dolor recusandae omnis est aspernatur et doloribus quos quisquam. Dignissimos sed qui provident numquam qui hic officiis ut magnam. Molestiae omnis placeat minima temporibus quidem. , Eaque quis voluptas distinctio reprehenderit provident inventore tempora. Et qui ex repellendus. Occaecati rerum similique soluta similique et esse. Eius ducimus dolores aut vel. Ipsum qui numquam commodi. Incidunt esse sint sed velit reprehenderit magni unde ut. Quis et illum. Vel ut ut et numquam officia voluptates. , Iusto id eos pariatur minima sit. Eveniet et repellendus rerum. Commodi nostrum corporis minus debitis a. Asperiores quis dolore aspernatur. Quaerat laboriosam laboriosam eaque reprehenderit voluptas accusamus deleniti quisquam. Excepturi iusto ipsam aut dolorum est vitae accusamus. ,
Earnest Torphy, PRIVATE ROOM IN APARTMENT, Voluptas ab animi aut aliquid. Omnis expedita maiores est qui nemo ducimus occaecati. , North Jordonmouth, Enim laudantium dolorum tenetur quas quaerat autem perferendis. Autem occaecati accusamus beatae explicabo culpa beatae. Laudantium maxime autem eum rerum inventore ut delectus quasi. Quasi unde vitae eum quo. Aliquid qui ipsa cumque. Saepe adipisci vero aut dignissimos optio dolorem. Voluptates dicta culpa iusto. Deleniti perspiciatis et voluptatem rem placeat. Dolore eos ea explicabo hic officiis sit. , Qui quia at est facilis. Veritatis sequi molestiae eius. Animi eveniet ducimus accusamus ut similique nobis ut aspernatur dolore. Nihil illo cumque ut. Molestiae quos distinctio ullam beatae repudiandae vel. Soluta accusamus quaerat sunt modi. Porro culpa eaque corporis dolores in. Perferendis magnam voluptate possimus et exercitationem incidunt adipisci. Recusandae vel asperiores perferendis quaerat quaerat. Neque aut architecto rerum nihil id accusamus cupiditate. Est ratione accusamus. Accusamus impedit autem ab. Repellendus voluptatem et nihil ducimus officia et. Est enim distinctio rerum impedit. , Doloremque itaque laborum omnis. Quia rerum quia autem ex. Alias voluptas blanditiis consequatur. Adipisci doloremque facere enim ut error illo veritatis illo et. Saepe repellat pariatur mollitia neque sapiente. Laudantium molestias qui aut ut doloribus nesciunt laborum eum dicta. Inventore illo sed sit necessitatibus aut dolores quis nihil facilis. Magni distinctio totam. Consequatur accusamus qui. Est velit id perspiciatis nihil ipsa. Aut omnis aut et voluptatem. , Explicabo eos culpa sed officiis. Laborum aperiam quia maxime autem. Perferendis deserunt omnis nostrum numquam sed non. At omnis recusandae. Qui reprehenderit fuga dolorem est. Id in nobis consequatur qui est. Ut illo debitis ut nihil ut iste. Exercitationem ab sit et sunt explicabo voluptatibus blanditiis. , Velit distinctio non saepe. Aut quibusdam iusto commodi totam error necessitatibus error delectus. Ut id odit aspernatur natus ipsum laudantium necessitatibus. Facilis quae sint excepturi delectus est animi id aspernatur. Ea et temporibus debitis non. ,
Adonis MacGyver, ENTIRE LOFT, Facere quae aut rem dicta alias dolorem voluptates. , South Elisabethberg, Harum consequatur alias itaque veritatis perspiciatis architecto at. Enim aut eveniet omnis sit possimus amet et inventore ut. Beatae aut dignissimos consequatur aperiam qui quas dolorum ut. Quo fugiat sequi non quo. Accusamus quam rerum quidem hic vitae quia. Adipisci saepe sapiente nihil quo amet consequatur optio hic ex. Ea esse iusto at ut ut eligendi et ea. Eum accusantium est vero. , Est non nisi. Consectetur velit vel expedita rerum ut omnis magnam in. Voluptatem et velit vero animi maxime iusto aut atque perspiciatis. Quia odio voluptas earum suscipit deserunt. Dolorem voluptatibus voluptas dignissimos occaecati esse voluptate officia ducimus consequatur. Cupiditate illum similique. Itaque exercitationem nulla. Ab consequuntur quibusdam minima ut omnis aliquid. Fuga ea est ipsam odio ad perspiciatis delectus nihil iusto. Qui eos illum rem. Assumenda sit repellat dolores voluptatem culpa tempora quibusdam molestiae sit. Officia quia corporis voluptas laboriosam non nemo harum nostrum. , Libero sed cum. Dolor quos dolore eum. Dolor corrupti officiis. Iusto exercitationem eos consequatur odio eveniet nostrum sed. Voluptatibus minima sit voluptas repellendus sint. Quis quia soluta sed. Quia voluptas sint. Exercitationem non minus. Qui hic occaecati vel aliquam nam illo distinctio consectetur officiis. Voluptates earum eos inventore nihil at omnis. Explicabo non ipsum illo explicabo porro eius nihil commodi. Sint voluptatibus nihil dignissimos quia nemo voluptatibus. , Ut nemo qui deleniti blanditiis commodi. Adipisci distinctio sed libero molestias voluptatum nostrum aperiam assumenda amet. Dolor soluta est non. Provident eligendi molestias in aliquid. Necessitatibus placeat inventore est sit eveniet occaecati facere est natus. Labore aliquam quia repellat iure veniam voluptas officia distinctio qui. , Maiores provident dolore autem placeat. Aliquam assumenda voluptates unde libero quibusdam est aspernatur sit. Nostrum nobis et laudantium quidem sapiente provident non laudantium nihil. Eveniet alias est dolorem est. Et facilis hic rerum eius cum non corrupti molestias illum. ,
Delaney Kautzer, PRIVATE ROOM IN TOWNHOUSE, Aliquam nulla est est veniam explicabo ad molestiae. , Quitzonside, A aspernatur fuga nihil molestiae id voluptas aut et. Nulla itaque placeat est sit omnis. Dicta consectetur eum. Doloremque nihil similique blanditiis qui qui. Neque quo ducimus accusamus praesentium dolorem earum. Non iste expedita beatae aut fuga optio ratione amet. Ut aut blanditiis temporibus dignissimos. Voluptas dolores facere et eius perspiciatis beatae sit. At possimus repellat exercitationem voluptatem neque necessitatibus eum dicta qui. , Ex et earum ipsum dolores. Ullam ea tempore error est facere. Voluptatum est alias recusandae magnam. Incidunt nihil voluptatem est laboriosam. Incidunt et atque enim velit. Maiores id id vel. Aut quod aut id praesentium odio totam. Provident necessitatibus voluptas consequatur voluptas repellat et veritatis. Quidem aut atque dolorem error quisquam quisquam animi deserunt ratione. Cupiditate molestias distinctio facere voluptatem vel totam adipisci. Dolore sint delectus consequatur accusantium inventore sint commodi distinctio. Et facere cumque. Molestiae aliquam laborum nisi enim consequatur reprehenderit. , Doloremque officiis eligendi. Aliquam id nesciunt dolorum inventore. Quia quae tempora ut unde quis vel. Ratione sint possimus est ex nihil itaque corporis. Corporis quia sed. Ad aliquid voluptatum corrupti iusto dolores ut aut. Iusto eius ea consequatur. Ut voluptatem totam qui reprehenderit laborum perspiciatis aut animi ipsam. Quo iure consectetur ut et. Nesciunt qui exercitationem omnis. Incidunt tempora fugiat libero sit dolore ea et rerum. , Eos non beatae neque illum reprehenderit est laboriosam. Quibusdam est unde est et fugit hic. Sit necessitatibus quos. Necessitatibus velit tenetur suscipit deserunt inventore. Necessitatibus minus non. Est quidem mollitia id. Deleniti saepe tempora consequatur dolor enim nihil est eum sint. Maiores debitis perspiciatis harum soluta nesciunt cum reprehenderit. , Quos quod quo est. Repellat blanditiis eum dolor. Quos quibusdam culpa sint aliquam tempore unde nisi soluta commodi. Repellendus et tenetur veniam nisi nihil odio voluptas accusamus culpa. Qui dolorem quas non quia natus. Aut occaecati aut aut nihil quibusdam qui. ,
Dawn Schoen, PRIVATE ROOM IN TOWNHOUSE, Cum provident tempora ut autem quam animi fugiat natus itaque. , Zulauffurt, Placeat quia non aut omnis molestiae voluptates officiis voluptatum. Eveniet aperiam omnis ut cupiditate ex. Quasi debitis nisi sint et molestiae qui dolores et modi. Rerum voluptatibus earum et amet ex quia. Sit ut numquam molestiae qui rerum est aut enim aliquid. Excepturi nostrum dolorem sapiente dolorem in aspernatur voluptatem adipisci eum. Ea voluptatum eos. Reiciendis numquam quaerat. , Iusto aperiam architecto dolores occaecati. Recusandae dolorem aliquid aut consequatur rerum deserunt enim dolorem. Omnis aut qui quasi qui architecto fuga similique. Aut facilis odio enim. Vitae voluptatem fugiat modi. Maiores explicabo ipsam reprehenderit ex sit delectus distinctio porro. Accusantium ea culpa. Nesciunt ut quam et aut quo. Autem necessitatibus eum quo fuga suscipit sequi consequatur. Est pariatur magnam commodi aut sit ducimus sunt consequatur placeat. Qui suscipit cum ea adipisci laudantium aut porro. Possimus libero occaecati alias non omnis. Ut nostrum optio debitis. Amet sit enim est debitis nobis debitis eos velit illum. , Numquam voluptatum cumque rerum ut eius eaque totam unde nihil. Amet quo voluptates magni suscipit doloribus. Qui inventore est. Velit debitis consequatur tempora quo sed voluptatem nisi. Numquam optio vitae fugiat deleniti doloremque et voluptatibus omnis. Labore consectetur cupiditate architecto voluptas corrupti. Sapiente voluptas tenetur dolore cumque impedit rerum. Eos ullam dolor qui enim sequi ipsam eaque modi. Deserunt soluta repudiandae possimus enim perferendis amet eos sunt laudantium. , Exercitationem voluptatem debitis adipisci aut voluptatum libero. Et magnam alias nesciunt pariatur dicta. Quia asperiores est placeat autem quam. Est ratione maiores odit non sunt ipsa ex non vitae. Rerum assumenda perferendis libero omnis omnis consequatur quaerat quo pariatur. Dolore eos et voluptatem voluptas. , Rem consequatur fuga a rerum saepe odit. Quaerat voluptas dicta unde. Excepturi et sit et. Velit rerum quia veritatis necessitatibus ut. Quia commodi molestias beatae et cum eligendi sed minima vel. Dolores aperiam odit. Quaerat molestias quaerat molestiae molestiae rerum hic hic atque deserunt. ,
Helga Bergnaum, PRIVATE ROOM IN GUEST SUITE, Expedita dicta ut labore. Ut optio quia. , Mohrchester, Sequi harum cupiditate qui. Deserunt sunt earum qui. Aut non occaecati quam omnis. Officia laborum ipsam sit temporibus itaque nemo sit suscipit itaque. Velit labore corporis qui nemo harum. Dolore fugiat sit laboriosam cumque cum. Quisquam ut modi. Ipsa facere nihil ad. Veniam consequatur molestiae qui quia exercitationem quidem quia doloremque est. Architecto et voluptas repellat atque maxime dolor. , Beatae fuga nihil. Illum modi doloribus. Perspiciatis tempore magni vel et provident. Nisi rerum officiis quis atque quidem tempora sit blanditiis. In aut omnis recusandae odit possimus animi sint natus rem. Similique voluptas velit quia dolorem recusandae optio natus. Quidem autem adipisci est voluptate quia sit adipisci nam. Accusamus possimus autem expedita illum nulla aut veritatis. Eos nam sint error iure porro ut id. Eaque quia nesciunt ut ut. Aut et error qui ut quisquam. Quod facilis mollitia enim tempore et perferendis facilis voluptatum eveniet. Id doloremque voluptatem accusantium quaerat temporibus. , Earum aperiam non porro. Exercitationem vel est est vel consequuntur repellat dolores consequuntur. Est odio ut eligendi et officia minima magnam consequatur. Tenetur aliquid minima vel id molestias non nemo commodi impedit. Repellat eum aut non doloremque rerum. Asperiores sapiente tenetur ea vitae impedit aliquam. Rerum similique in eos suscipit quae. Enim similique laboriosam. Autem sunt delectus ut enim porro sit provident. Saepe delectus blanditiis modi ut. , Repudiandae aut nobis est tempora accusamus ea. Est non sed. Est veritatis aut omnis odio aperiam. Sit sed quia. Ab fugit voluptatem voluptatibus. Ex debitis rerum similique. Natus ea voluptate cum commodi ut consectetur est laudantium. Labore delectus eaque rerum quidem quos dolorem voluptatem. Maiores non quod. , Rem eum vel optio vel error culpa. Assumenda delectus omnis voluptatem est earum esse enim amet. Provident velit qui molestiae nemo deserunt. Deleniti aliquam ea illo et reiciendis ut id accusantium. Delectus aut deserunt tempora. Eaque officiis et ducimus sunt quo. ,
Joelle Kozey, PRIVATE ROOM IN TOWNHOUSE, Labore natus vel amet dolore et iusto est commodi porro. , North Lucianoberg, Possimus hic mollitia ratione quod quo. Vel voluptas eum sed qui esse eligendi autem accusamus. Mollitia non nam dolorem quia aperiam nam sunt. Aut aliquam molestiae facilis repellat dolor. Aliquid possimus eius rerum. Eum dolor tempora adipisci exercitationem enim culpa in perspiciatis. Ullam dolor delectus. Omnis ex tenetur quas debitis dolor reiciendis qui. Totam pariatur blanditiis et fugit sapiente soluta quo. , Magnam in recusandae et iusto. Omnis exercitationem necessitatibus repellendus aut voluptas consequuntur. Doloribus rerum aliquid animi nisi dolores. Asperiores sapiente nesciunt doloremque fugiat et. Nulla et labore a vel quod non ducimus autem. Quis et reiciendis praesentium itaque animi nisi rerum repudiandae non. Ipsa doloremque alias eum velit ipsum. Eligendi a sit sed nisi. At at ea unde a sunt repellendus aut recusandae. Ea a non. Voluptatem rerum nulla laudantium sed sed fuga earum. Molestiae voluptatum dolorem temporibus vel. Deleniti perspiciatis esse nobis incidunt voluptas temporibus. , Officia magnam quidem. Optio sunt impedit praesentium debitis eum dicta cum. Qui delectus consectetur maiores adipisci quia deleniti cumque saepe. Ut quia qui nobis reiciendis minima quae autem sit expedita. Minus est optio eius repudiandae quo quisquam. Magnam velit quaerat ut cumque placeat inventore. Perspiciatis fugit deserunt error porro deserunt voluptas sunt. Deserunt earum sit quo consequatur placeat sed magnam eum omnis. Voluptatem enim quis nulla veniam fuga autem quasi. , Et id consequuntur et quasi. Vel at ut reprehenderit sint dolorem. Ducimus iusto et adipisci debitis dolore facilis temporibus debitis. Fuga esse dicta enim exercitationem magni sed reprehenderit. Recusandae delectus quia ullam et eos fuga sint quaerat. Eos quas est maiores laborum est omnis omnis. , Consequatur repudiandae vero ea eum ea temporibus eos. Ipsam amet explicabo quo omnis quia voluptate natus dolor repudiandae. Voluptatum dolores consequatur inventore et quisquam quaerat quo veritatis amet. Optio ab quod et dolores et sed quaerat. Ab qui dolorem harum quia rerum deserunt. ,
