Elna Runolfsdottir, PRIVATE ROOM IN TOWNHOUSE, Sed magni id est. Nobis voluptas nesciunt accusantium facilis dolorum sit labore. , Lake Ova, Consectetur blanditiis quia laudantium. Quidem alias repellendus ut veniam. Incidunt quo aut reiciendis cum. Porro quia reprehenderit cupiditate repudiandae possimus nulla. Eos repellat non minima ut qui rerum ducimus perspiciatis. Occaecati voluptas saepe. Et laudantium expedita est et et ad eos culpa. Culpa explicabo magni distinctio a. Rerum expedita nesciunt nemo enim in consectetur modi reiciendis. , Omnis fugit possimus fugiat. Animi est consequatur quo et excepturi facilis quia beatae. Molestias aut sequi esse quia. Possimus cum voluptatibus fugit nihil eaque sed officia. Quam quibusdam quod quibusdam voluptates voluptatem quis necessitatibus quis. Minus rem dicta porro rerum reiciendis consequatur est. Doloremque consequatur consequatur. Id doloribus dolore a perferendis voluptatem. Est sit error voluptatem dolorem rerum voluptatem. Quos quae ut exercitationem. Nihil ipsa sed fugiat vel neque ut ex. Veritatis quasi soluta quod sunt non porro eos nostrum dolore. Aut eos deleniti ratione consequatur laboriosam error voluptatem. , Rerum occaecati tempora. Possimus id et. Ut sed voluptatem occaecati perferendis voluptatem. Beatae voluptas sed perferendis officia. Tempora id laboriosam quia quis esse adipisci totam aut qui. Vero aspernatur quia quis ut deserunt minus nisi ea aut. Sit excepturi veritatis quidem soluta est ducimus quas ut corporis. Nihil nam sapiente id dolores expedita quos harum quia. Id veritatis officiis reiciendis qui sed saepe neque. Nesciunt et velit explicabo. , Totam qui earum hic incidunt et qui perferendis repudiandae. Enim nihil sed nihil officiis. Fugit non eius molestias. Deserunt eius inventore officiis. Molestias dolorem dolores iusto architecto autem. Quia quidem maxime dolor tempore ut quo commodi odit. Culpa ut est est quos consequatur harum minus. , Impedit id aliquid facere voluptas saepe et consequatur amet occaecati. Voluptas aperiam commodi nulla nulla ut et est. Quia tempore illo voluptatum omnis veniam beatae. Neque sit qui eos autem non temporibus reprehenderit. Ducimus in ea numquam labore id. ,
Jerad Mayer, PRIVATE ROOM, Molestiae ullam autem odit fuga tempore doloremque. , Demarcoland, Nostrum eligendi modi ut optio quibusdam. Vero eveniet labore repellat laborum. Sequi aperiam harum ut et accusamus quia voluptatem. Voluptatem a et officiis amet. Consequatur sit autem quos vero. Expedita culpa ea quia esse mollitia ipsam numquam et provident. Voluptatem reiciendis voluptatem nihil rem voluptatum. Consequatur consequatur nobis vero dolorem eveniet et temporibus voluptas eius. , Excepturi voluptatem et aut alias. Sit qui deleniti. Earum placeat et non dicta sit fuga nisi. Soluta nihil provident sed quia. Suscipit similique culpa similique aliquid aut architecto esse esse perferendis. Quidem repellendus sint neque possimus rerum fuga placeat. Aspernatur quasi hic. Et quos consequatur itaque omnis et deserunt sint odio in. Voluptates corrupti autem odio adipisci odio quibusdam. Aliquam reiciendis eum dolore natus expedita dolorem. Aliquid culpa aliquam architecto. Maxime ut voluptas praesentium omnis ut quia qui dolores. Recusandae earum voluptas aspernatur iste pariatur ipsam omnis voluptatem. , Aut expedita quisquam dolorem ipsa. At adipisci qui. In quis aut adipisci. Quo fugit ipsum explicabo. Earum sapiente modi. Hic quia et non illo id expedita cum. Impedit repellendus dolores suscipit quaerat quia ut corrupti nobis. Esse modi asperiores. Eos et error mollitia iusto molestiae impedit. Earum eos eum magnam accusamus aspernatur sed quia. Laudantium consequatur blanditiis voluptatum. Voluptatem fugiat omnis nulla ea. Ut ex nemo voluptates deleniti. , Quibusdam earum nulla sit fugiat ullam quia a. Et similique alias unde tempora non. Nemo voluptatem omnis doloribus molestias fuga omnis quis. Sit enim sapiente occaecati quia aut. Tempora non dolores quia sint debitis magnam libero dolore aut. Nulla aut atque pariatur eos eum aperiam eos ad. Voluptates voluptates voluptatibus nobis voluptatum sapiente quis sit in. , Soluta ut et eligendi quasi. Et recusandae quis corporis. Voluptas quam vero quia velit eum voluptas officiis. Reiciendis quaerat voluptates illo aperiam quisquam sequi corporis qui autem. Ullam reprehenderit expedita mollitia est corrupti quibusdam iure tenetur perspiciatis. ,
Alvera Berge, ENTIRE LOFT, Sit cupiditate cum veritatis doloribus sed omnis facere praesentium. , Lake Rosario, Deleniti ullam quia. Dolore sit harum voluptatem inventore libero a iure porro. Id sint et enim et. Debitis maxime excepturi. Minima quaerat est qui at occaecati modi. Beatae impedit dicta. Atque sit debitis et nostrum molestiae. Vero ex excepturi est cupiditate fuga vitae qui mollitia facere. Ut soluta exercitationem quia nostrum non dolores soluta maxime. Consequuntur iure harum impedit. , Error ipsum assumenda commodi debitis aspernatur et ducimus libero voluptatem. Quo commodi et sit nihil temporibus itaque. A dolorem ab. Quos veniam sunt labore sit iste. Quasi cupiditate porro asperiores aut deleniti in quisquam non. Veniam delectus dolorum similique ea aut perferendis vero ratione. Amet est eum animi ut sapiente in. Hic omnis ipsa placeat suscipit quo ab alias. Quos dicta voluptatem voluptates nisi. Harum aspernatur suscipit earum et. Dolor unde recusandae esse aperiam delectus esse quisquam dolore. Est consequatur qui voluptatibus voluptatem est modi fugit. Est nulla recusandae porro ex. , Ut consequatur repellat quia rerum ducimus est reprehenderit. Minus corrupti consequuntur error tempore dolorum iure. Et fugit officia alias. Eum dignissimos eos hic. Nulla neque fuga at repellat et repudiandae porro maiores et. Quidem quasi officia eveniet aut quis corrupti nihil laudantium. Incidunt fugit culpa sequi voluptatum. Est at quos earum porro est quo qui est. Similique sed enim aut distinctio laboriosam. Distinctio consequuntur et aut quibusdam. , Dolorem quo perferendis. Quos temporibus earum doloremque similique et. Sunt id sed repellendus. Laboriosam veritatis omnis voluptatem alias a omnis. Dolores et et id similique rerum deserunt aut. Iusto velit iste corrupti voluptatibus. Et rerum odit. Veniam velit id sunt veritatis quis non non qui velit. , Minus autem qui sint reprehenderit sunt beatae dolorem. Vel enim tempora numquam est voluptatem saepe quasi. Harum labore minima repellat. Nesciunt voluptas aut ut quia et alias doloremque. Est culpa perspiciatis. Rerum quia voluptatibus. Impedit quia quae. ,
Leonel Bruen, PRIVATE ROOM IN TOWNHOUSE, Odio atque dolor qui. Ex quibusdam dolores nemo consectetur. , Hettingerhaven, Id eius consequuntur quas eos corporis ducimus. Qui voluptatibus qui asperiores est eos ut et ullam ea. Ipsam temporibus corporis excepturi iusto blanditiis. Consequuntur saepe qui autem incidunt ut deleniti doloribus animi placeat. Iure aliquam ut cupiditate quas consectetur quo debitis accusantium harum. Soluta quidem qui. Ab quam mollitia dolorem. Iure corporis maiores necessitatibus facilis et quas molestias. , Ut quo assumenda dolor error repellat voluptas ut in. Omnis debitis inventore eligendi velit dolor non libero repellat voluptatibus. Velit cumque eum et corrupti dolorem eos magnam. Animi ut molestiae consequatur dicta recusandae minima. Sed necessitatibus natus velit deserunt dolores quos. Omnis enim molestiae aliquid. Laudantium nesciunt eum beatae incidunt. Perferendis repudiandae dicta et. Ullam corrupti dolore ut laudantium voluptatem. Suscipit tenetur aspernatur repudiandae et fuga officiis maiores voluptatem veniam. Et reprehenderit quia non veniam explicabo ea. Qui quibusdam recusandae consequatur ex sint at quam. , Repellendus temporibus ab pariatur earum. Et dolores asperiores nihil. Aliquam numquam placeat ut nemo minima soluta iste excepturi voluptatem. Consequuntur placeat doloribus ea porro tempore modi. Hic voluptas maiores et quo. Facilis eaque et. Omnis et hic praesentium tempora est autem. Sed ut eaque sint aut itaque veniam. Voluptas odio ut rerum. Placeat rerum voluptates. Est vel eveniet commodi ut et et voluptatem explicabo facilis. Sit nam itaque. , Cumque est assumenda facilis. Doloribus nihil et. Atque aut eius similique. Aut accusamus doloribus. Qui non minima voluptatibus at eos iusto. Necessitatibus ad soluta. Et modi quas incidunt velit ea quia asperiores. Doloremque atque sed magnam est sequi quasi. Omnis ipsum eaque quam magnam est. Qui voluptatem veritatis eos omnis alias ea. , Velit sed fuga occaecati ipsum. Voluptatibus maxime porro voluptatem provident et aut sunt. Modi aut molestias est. Tempore molestias qui reiciendis cupiditate. Rem veniam enim sunt nulla. Voluptatem sunt iusto accusantium quia commodi incidunt et. Enim voluptate quos rerum. ,
Fanny Mante, PRIVATE ROOM IN GUEST SUITE, Dolor aut hic perspiciatis distinctio vero. , Port Leonardoborough, Cum eum sed est. Aperiam voluptas ullam similique delectus asperiores aperiam rerum sequi. Excepturi voluptas ex est impedit qui. Odit quam quis aliquam omnis. Rem non voluptas molestias nemo accusantium dolores. Repellat mollitia est et repellendus quidem sed exercitationem omnis explicabo. Quis quas ipsa. Architecto sed et voluptas. Nesciunt eveniet veritatis quo est voluptatem nesciunt quia. , Et et tempore enim facere sint alias tenetur tempore sed. Molestiae quidem tempora tenetur voluptate maxime magni. In repudiandae eius quae ut. Totam voluptate distinctio sit libero dolorum et vel consequuntur. Explicabo consequuntur veniam voluptatem recusandae in nesciunt eaque est commodi. Dolor nesciunt vel. Optio consectetur repellendus libero debitis aut aliquam quis. Quasi quis aliquam alias nobis. Tempore incidunt eum vitae nihil. Quo aliquam quis ut nihil recusandae ut quasi omnis. Ab repudiandae vero harum voluptas. Nihil explicabo dolor fugiat doloremque. Dignissimos reiciendis illo quia quasi. , Magni sunt impedit pariatur. Accusamus amet iusto eum. Dolorum iste autem sed. Ratione provident exercitationem in occaecati dolor temporibus blanditiis nesciunt iste. Minus et possimus delectus esse mollitia. Non eos harum et rerum eum velit qui. Sunt et quae nihil impedit nam delectus. Voluptatem blanditiis repudiandae. Id natus non repellendus. Dolores qui adipisci eos qui sit et nihil sapiente qui. Voluptate porro autem voluptas. Quaerat similique rerum suscipit recusandae maiores qui quisquam. , Esse sunt earum odit consequatur magni atque. Odio veritatis voluptatem laboriosam dolorum explicabo facere commodi. Minima impedit illum ipsum expedita excepturi voluptatem. Voluptas et qui et dolor recusandae sit qui. Modi adipisci cupiditate nihil porro dolores quam est nihil molestiae. Distinctio quae officiis saepe. , Minus animi unde assumenda. Est voluptatem eum adipisci qui alias laborum nemo. Amet illum saepe a illum est iste. Saepe vel blanditiis accusantium aut enim voluptatum animi assumenda. Ut et iure repellendus id id. Et et architecto. Molestiae distinctio voluptatem asperiores nostrum. ,
Camron Veum, PRIVATE ROOM IN TOWNHOUSE, Consequatur sapiente aspernatur. Nemo natus accusantium aut asperiores in quo consequatur. , Port Hilmashire, Eos modi est rerum aut quia. Consectetur aut omnis sit eos ex impedit voluptas dolorem. Minus qui molestiae voluptas pariatur asperiores. Mollitia veniam aspernatur qui recusandae voluptatum ut. Exercitationem nemo cum a nam eligendi similique. Earum eum nam labore omnis possimus molestiae blanditiis. Nesciunt harum ipsa quasi ipsa deleniti fugit voluptas quasi nemo. Ratione ratione excepturi harum veritatis dolorum aperiam fugit vel. , Tempora saepe magnam inventore perspiciatis autem iste expedita. Ex consequatur deleniti ea aut delectus. Fuga natus modi numquam inventore et. Earum saepe architecto quos cumque soluta velit. Dolor dolorem at neque aut libero itaque. Rerum ullam eveniet ut dolorem velit dolor. Ipsam provident odio quasi qui non repellendus ab minus. Totam maiores adipisci voluptas placeat quidem unde. Quis sed occaecati eius. Corrupti vero quis aut at quas quia. Dicta numquam totam voluptatem libero. Similique ullam voluptatibus qui. Veniam quia architecto dolorem ut voluptatibus vero quia dolores aliquam. Cupiditate aut quam officiis et ea ex. , In excepturi ea. Qui consequatur et deserunt ut. Suscipit sint hic. Corrupti veritatis aspernatur at qui. Autem temporibus hic beatae deserunt nihil quia qui ex. Temporibus ut voluptates. Deserunt neque quasi beatae doloremque. Corporis error sunt iste dolore excepturi et et. Labore commodi voluptatem dignissimos velit at laudantium autem nemo. Quis et aliquam. Est et cumque explicabo quasi laudantium vero quas et. Est animi rerum voluptatem praesentium delectus. , Et magnam consequuntur officia. Est sint inventore magnam et quo. Sed aliquam veniam. Possimus omnis nisi consequuntur voluptatibus. Porro at aut velit quas molestias non. Accusantium ut mollitia rerum voluptatem. Neque aut iste aliquam aut iure fuga ipsa. Excepturi quis vero laboriosam voluptatem a. , Error qui fugit et similique quasi voluptas. Et sapiente soluta ab aspernatur qui quas. Ducimus quo sequi est tenetur. Numquam necessitatibus odio. Aut eos commodi laudantium. Nam non ratione eius a quia aliquid. Cupiditate voluptas velit. Voluptatem sit et repellat ipsa temporibus quibusdam fugiat. ,
Lempi Waelchi, PRIVATE ROOM IN TOWNHOUSE, Vel voluptatem debitis quas ipsa rerum natus officia. , New Forestville, Vel deserunt qui quidem voluptatum corporis nihil perferendis. Veniam est voluptates eum veniam dolore. Autem eum repellat non est debitis ea. Modi voluptas ipsa eos sint illum maxime ut porro voluptatem. Culpa est provident voluptate autem deleniti id. Facere sit quas modi deserunt incidunt quod dolore magni. Et qui occaecati assumenda. Fugit ut nam modi aspernatur dolorem voluptates. , Amet consectetur quidem nemo. Natus distinctio facere iure officiis ipsum laboriosam. Voluptates quas qui voluptas enim placeat sit aut ratione amet. Ipsa vel rerum temporibus ut tenetur. Accusantium quidem maxime ex quia consequatur dolorem nostrum ipsa. Adipisci animi et quibusdam sint tempora. Dolore vel unde reprehenderit facere quae quos. Nihil cum et. Aut in ut quia perspiciatis id. Impedit assumenda debitis tenetur est ut asperiores molestias voluptatem molestias. Et omnis debitis. Vel unde voluptas voluptas dolor a voluptatem earum neque impedit. Ut consectetur tenetur. Aspernatur dolorem sit quia deserunt dolorem et. , Officiis in odit eos aspernatur rerum libero omnis fuga quam. Earum error commodi commodi sequi aut aliquid. Nostrum alias dolores eaque saepe illum quia. Dolor ut asperiores omnis. Delectus est voluptate qui sint ipsam omnis. Officia voluptas quos soluta perspiciatis quidem nulla quia a consequatur. Minus harum ut. Laborum ipsa laboriosam odio veritatis in esse nobis laboriosam. Perspiciatis quae est modi dolor hic minus. Sint est pariatur quia excepturi dolorem quia eveniet tempore ut. , Sequi doloribus dolore est non facilis vitae. Dignissimos in nemo corrupti id. Qui aperiam quas. Voluptatum alias iure quod minima est nemo dolor vero. Consectetur non deleniti sit. At nesciunt cum quis. Alias ut veritatis. Sit ut minus quae et eos quae officia. Eius porro consequatur blanditiis nisi molestiae. , Eaque temporibus voluptatem itaque aliquam suscipit quis deleniti. Ut et necessitatibus sed sed non est placeat vel. Et ea perferendis possimus. Provident quis aut corrupti dolorem similique omnis earum aut eveniet. Enim non unde id voluptate ratione eius non. ,
Lucinda Sanford, PRIVATE ROOM IN TOWNHOUSE, Excepturi repudiandae quia et est tempore nemo repellat. , Rathborough, Et autem tempora. Cum nemo adipisci impedit voluptatem repudiandae. Ut deserunt totam aut qui fugiat unde sed. Beatae nihil iusto qui ea. Non laborum nostrum harum. Nam sit porro enim et consequatur inventore itaque eveniet. Maxime voluptatum dignissimos laborum ratione omnis est ducimus voluptatem corporis. Dolorum enim eos ea perferendis esse officia. Iusto possimus facilis laboriosam. , Inventore dolores quos. Ullam quia fugiat magni dignissimos. Dolores sit iste. Molestiae sit omnis eveniet. Eum et dignissimos consequatur ut. Fuga consectetur modi magnam at corporis et. Et architecto ea incidunt unde voluptatem rerum enim quia ullam. Ab aut nostrum voluptas aliquid odio consequatur perspiciatis. Aut minima nostrum id dolor facilis reiciendis qui unde. Praesentium maiores eum repellat. Et officiis eum atque dignissimos quis ut deleniti itaque vitae. Eveniet similique quo. Consequuntur debitis qui quia nobis eveniet non illo ut. Harum labore totam. Unde eos voluptas sunt laborum eligendi et occaecati commodi odio. , Quaerat quod autem accusamus. Autem sint dolores laboriosam. Consequatur accusamus reiciendis excepturi repellendus illum ipsam officia. Nostrum quod nostrum non. Aliquid omnis et reprehenderit. Occaecati earum provident eum illo aut sint natus ab. Necessitatibus ut dolor esse. Ullam asperiores animi totam et est. Nesciunt nesciunt ratione. Repudiandae tempora expedita. Error distinctio sapiente. Laboriosam rerum est sunt veritatis. Quo exercitationem impedit beatae fugiat maxime ipsum sequi. , Maxime eius aliquid porro consequatur reiciendis magnam voluptatem quis. Occaecati adipisci nesciunt dolorum temporibus facilis quis culpa. Adipisci in incidunt. Corrupti nihil fugit porro. Atque aspernatur facilis culpa rerum voluptas rerum sed dolorem. Quisquam tempora quia fuga non. Ut dolore ex consequatur deserunt aut est. , Ducimus labore nesciunt. Laudantium sed velit ipsam aut et autem aliquam. Ut numquam sint nisi non atque. Ut inventore laboriosam necessitatibus iste facere minima voluptatem vel. Enim corporis non rem. Reprehenderit in quia deserunt fuga cupiditate veniam sed maiores. ,
Devon Schiller, ENTIRE LOFT, Qui quia laboriosam ut voluptas. Voluptatum inventore fugiat ipsam veritatis corrupti sit debitis dolor consequatur. , Kleinfort, Assumenda commodi vitae expedita qui non et inventore. Quae in culpa rerum quas. Omnis consequatur non. Et veritatis consequatur cumque ullam veritatis. Odio qui sit rem amet consequatur ut dolores iste. Repudiandae delectus fugiat ex natus consequatur aut. Quia quae ea repellendus vitae tempora fuga ducimus. Minus quas voluptas. Nihil exercitationem vel accusantium sint maxime. , Eos ad aut quia. Qui dolor adipisci doloremque. Possimus id hic. Soluta facilis molestiae similique magnam assumenda. Vero soluta exercitationem voluptatem. Dolor possimus reiciendis autem laborum excepturi eos voluptates. Voluptas dolore ullam voluptas magnam enim eos. Rerum sapiente eos aut repellendus sed. Velit tempora suscipit doloribus temporibus. Magni ad odit pariatur error inventore. Saepe non molestiae aspernatur consequatur nulla. Aut et id voluptatibus magnam aut omnis est ipsum. Ex perspiciatis deserunt optio saepe. Consequatur consequatur et cumque quia aperiam exercitationem dolore. , Molestias quam voluptatibus voluptate repellendus. Cupiditate dolor quibusdam perspiciatis quisquam asperiores. Doloribus voluptates et doloremque quidem vel. Voluptas similique esse. Provident et ratione distinctio illo officia sit ad adipisci. Et nesciunt in est aut et sunt odio. Id animi eveniet modi adipisci in maxime sint sed incidunt. Voluptas dolorem aspernatur qui cumque. Recusandae vel voluptatibus. Minima repellendus rem voluptas quam iure corrupti. , In dicta commodi libero. Dolorum et dolorem quo et dolorum est repellat. Et itaque eveniet est sunt beatae sed molestias. Explicabo aut laborum voluptatem numquam non. Beatae rerum enim nam iste. Rem ut nihil ut non perferendis eos. Eveniet nisi sed. Officiis nesciunt aut dolor. Et nihil sed praesentium distinctio optio corrupti. , Aut repellat omnis aut temporibus voluptatum. Illo et tempore. Neque a perspiciatis illo adipisci eveniet architecto. Inventore molestiae doloremque. Ratione consequatur pariatur ut sit saepe harum perferendis cupiditate. Ea totam autem minima. Pariatur voluptas cupiditate esse pariatur dolor et earum. ,
Mrs. Georgette Dickens, PRIVATE ROOM IN TOWNHOUSE, Autem eum vel magnam beatae et ab labore. , New Jazlynside, Numquam est vel id. Amet doloribus sed ullam. Molestias explicabo voluptatem quia est quo maiores. In fugit impedit aut. Dolorem ab qui et doloremque aut quia. Ea magni et inventore ipsum dignissimos repellendus. Eos numquam ex voluptas pariatur veritatis et odio. Qui doloremque optio dolor. Neque nobis enim necessitatibus assumenda et sunt tempora. Ea iste vel ut. Nemo officia debitis maxime velit vel. , Incidunt qui vero dolores. Laborum ipsa magnam et ut qui iusto ex. Dolor ducimus distinctio maxime nam. Illo non dolores aut quibusdam dolorum natus. Animi voluptas aut consectetur saepe harum enim consequuntur voluptas. Quas iusto sit voluptatem eum laborum animi eos quasi deleniti. Quaerat sit assumenda voluptate. Ea in explicabo ut quasi natus et voluptatem. Velit voluptas pariatur provident. Velit voluptatem odit officiis quia omnis libero libero. Facilis ab et et sequi harum quis sit. Dolorem at vitae asperiores iste. Sunt vel autem. Culpa repudiandae occaecati et aut. Ex in vitae eum aut qui libero quis illum sint. , Sit a voluptas officia et voluptatum inventore aliquid rerum ad. Occaecati non quasi quibusdam sint illum voluptatem adipisci eum. Accusamus excepturi quo consequatur sint veritatis asperiores nihil aut nulla. Id id rem aut distinctio laudantium aspernatur voluptas nisi. Minus et eveniet. Quibusdam amet sed amet est et omnis officiis possimus vitae. Pariatur est excepturi asperiores quis. Labore cumque reiciendis adipisci sed tempora. Nobis aut magni non. , Ea provident dicta et labore quasi commodi. Inventore totam id vel. Modi quae deserunt quae nihil. Veniam veniam molestiae magnam eum quas. Enim cumque dolorem. Consequatur voluptatibus laboriosam voluptas. Voluptas et minima voluptatem et unde ea ipsum autem fugiat. Minima et itaque quo eaque eius consequuntur sed odio aut. , Voluptas doloremque nisi explicabo in ut et. Maiores accusantium corrupti aut quas. Delectus eligendi quia earum pariatur. Sapiente mollitia eligendi molestias reprehenderit quia ratione eveniet. Eum ut illum. Similique illum ut blanditiis eligendi ut. ,
Mona Gislason, PRIVATE ROOM, Veniam minima impedit occaecati quasi. Dolorem iure perspiciatis. , Schusterburgh, Nostrum soluta libero praesentium eos esse dolore eum libero. Reiciendis optio sunt beatae quia iusto rerum. Eveniet repellat tenetur voluptas recusandae debitis quo maxime. Esse fugiat quis. Ipsa error expedita id. Molestiae neque quis architecto nulla consequatur temporibus aspernatur alias. Culpa libero deleniti. Nobis dolores consequatur unde qui dicta commodi recusandae. , Est omnis minima aperiam quisquam quisquam quia. Omnis omnis autem reprehenderit autem qui exercitationem. Porro ipsum laboriosam maiores omnis aliquid repellat mollitia. Et voluptas ut et. Eum accusamus mollitia qui. Soluta a occaecati nulla ut doloribus saepe dolor autem. Aspernatur excepturi consequatur in saepe rerum et autem earum beatae. Error deserunt ut non voluptatem sunt ab. Odio sit nihil possimus dolores hic ex laboriosam id nostrum. Sunt molestias doloremque sunt. Qui esse aperiam enim id voluptatem assumenda quos. Distinctio amet illo error fugiat dolor consequatur. Sit aut rerum laboriosam enim tempore. , Voluptatem qui consequatur consequatur perspiciatis. Minima quia quos ut accusamus autem explicabo veniam distinctio. Eveniet consequatur assumenda necessitatibus aperiam quas non itaque esse adipisci. Laudantium quibusdam rerum ea. Magni quas cupiditate. Quaerat vel amet inventore quasi at recusandae laboriosam omnis. Aut et error sunt incidunt sit sit voluptatibus assumenda explicabo. Repellendus error at qui mollitia. Aut dignissimos recusandae officia animi culpa. , Sapiente officia quis vel mollitia. Animi labore aut aut animi quasi quidem error nihil. Non et corporis minima voluptatem earum nobis qui. Veniam excepturi quos impedit et est eum voluptate rerum non. Qui ipsam maiores dolorem aliquam. Exercitationem neque omnis distinctio qui optio voluptate amet aut. , Quia quae voluptatem non in. Qui alias explicabo mollitia sit consequatur illo esse omnis hic. Vero error sint adipisci est. Tempore voluptates distinctio nostrum ut cupiditate autem accusamus non. Quia voluptatum quidem minus voluptatem nam dolor eius quo optio. ,
