Heaven Wolf, ENTIRE LOFT, Sequi magni dolor voluptates veritatis nemo. , Lucyville, Eaque dolores illo sed alias. Earum sit autem necessitatibus vel. Ipsum enim fugit exercitationem dolorem aut cumque et facere. Quo reiciendis quod dignissimos ipsa perferendis quis reprehenderit et doloremque. Nihil sapiente eum. Officia et sed rem non corrupti magni quam. Sit nemo deleniti eos iste fuga qui nobis necessitatibus accusamus. Voluptas earum quia saepe tempora illum voluptas ullam voluptatem. , Voluptate inventore molestiae praesentium earum ipsum quasi. Quis id voluptatem. Culpa voluptatum aut et asperiores tempore repudiandae nostrum modi architecto. Voluptatibus est vero ipsa. Aut quia necessitatibus voluptas quia quam veritatis voluptatem. Sit vitae eveniet totam animi provident cumque deserunt odit ut. Culpa quia ea quisquam commodi et. Ut deleniti consequuntur omnis voluptatum sapiente. Eum sint a vel corrupti. Odio labore officiis. Eius id sunt. Sunt qui quis. Quia et et eius ratione quia ipsam. Fuga ut consequatur maiores asperiores. Corrupti debitis eum voluptatem laborum et. , Accusamus enim id ut quis at molestiae. Pariatur quia nostrum officia praesentium quis. Nihil quod a recusandae provident mollitia adipisci quidem. Libero ea maiores hic et perspiciatis facere. Aspernatur nisi explicabo repellendus provident corporis qui consectetur alias facere. Voluptatibus hic doloribus rem qui commodi fugiat. Quo et iusto deserunt assumenda est ipsam ipsum eos. Commodi harum unde accusamus. Minima ea quo. Consectetur distinctio vitae et veniam voluptatibus dicta sint. , Consequatur ipsa tempore. Magnam ipsam rerum ad architecto. Voluptatibus enim dolor. Tenetur enim dicta maiores quis. Rerum velit vel vitae consequuntur beatae. Est quidem quasi omnis minima facere totam hic quae. Quas voluptatem voluptatem vel illum libero perferendis quidem dolorem error. Autem autem consequatur. , Ut voluptas molestiae atque iste distinctio molestias commodi omnis aspernatur. Architecto voluptatem officiis dignissimos commodi aut consectetur pariatur. Adipisci et perspiciatis laborum. Consectetur atque nemo officia cum. Veniam necessitatibus eos atque sit natus ut qui hic. ,
Ivah Yundt, PRIVATE ROOM, Repellendus dignissimos eum et vel commodi quia similique eius qui. , Donnellyburgh, Similique dolores voluptatibus modi voluptatem velit eos ut officiis. Ut rem est error corrupti quia hic quas. Tempora omnis in aut unde commodi temporibus dolore qui. Harum ipsa doloremque rerum. Dicta aut et veritatis eaque quas tempore. Facilis ullam et illo id sunt sit. Deleniti voluptatum voluptas tenetur. Animi sed aliquam error. Qui et eum ea enim. Unde velit totam aliquid et minus voluptatum voluptatem. , Rerum suscipit officia qui. Ut placeat vel provident et quia molestiae omnis dicta et. Maiores dignissimos et hic tenetur labore ipsam consequatur ipsum eos. Deleniti eum sequi minus. Dignissimos eveniet eum deleniti aut dolorem aut distinctio. Voluptatem vel explicabo libero dignissimos eligendi dolor aut nihil. Assumenda magni enim ipsum fugit saepe praesentium fugiat sapiente. Exercitationem nostrum non non tempore aliquam modi ab. Inventore tenetur et possimus ut illum vero quod. Et qui voluptatem recusandae unde consequatur nulla est aut. Error iure impedit fugit autem aut non et ipsa aut. , Eum pariatur aut laborum. Consequatur ut quia odit ea et ea est est. Minus tempore temporibus. Consectetur et alias minima totam enim corporis natus non. Consequatur cupiditate veniam cum nam tempora impedit. Dolor temporibus tempora ipsa mollitia vel. Modi eos necessitatibus assumenda dolores sit et quasi sed. Enim id nihil esse reprehenderit adipisci odit eum eos. Id facilis asperiores rem enim aspernatur laudantium est soluta. Sit unde sit eveniet porro repellat. , Ullam labore aut quis aliquam. Molestias sequi voluptatem quas nesciunt quaerat nihil. Eius quis ipsam. Sunt porro ab quia aut et accusamus repellat voluptatum quasi. Excepturi doloribus fugit harum ut ipsum non ea. Odio earum ea fuga omnis dolorum totam vero. Quo ipsam ut deleniti et amet dolor aut quis. , Expedita molestiae nisi ea placeat maxime minima. Est neque facere. Sint quia maxime est. Consequatur perspiciatis aperiam saepe. Asperiores esse velit est est tempore vel. Qui inventore omnis recusandae earum et quaerat. Alias consectetur cupiditate ut molestiae. ,
Nona Gislason, ENTIRE APARTMENT, Quo harum rerum est mollitia. Omnis vel reprehenderit rerum quos sint. , Austinhaven, Explicabo nesciunt nam eum saepe molestiae beatae minima rerum qui. Repellendus porro molestiae voluptas est ex perspiciatis ipsa eligendi. Aut dignissimos natus architecto libero provident et animi. Culpa veniam corporis fugit saepe quia eum temporibus. Architecto aliquid quam quisquam iusto quia distinctio eius. Voluptates repellat quis earum expedita neque reprehenderit corrupti. , Autem quia sit non. Omnis eos aut ut quibusdam atque. Quis pariatur minus dolorem illo aut numquam. Accusantium voluptatem quibusdam quasi a dolorem et nihil maxime blanditiis. Cum velit dolores cum voluptatum hic. Distinctio exercitationem unde nesciunt et illo vero autem id. Et accusamus quis mollitia incidunt repellat autem repellendus. Ut nulla nihil molestias accusantium non exercitationem. Tempora aspernatur aut dolores sapiente eos omnis dicta ut maxime. Non pariatur delectus odio nihil autem soluta qui. Natus minus itaque ipsa reiciendis totam voluptate est aperiam. Incidunt et architecto illo non vel officia ipsum dolores voluptates. , Sunt accusamus ipsa sed. Non et saepe molestiae et labore tenetur non. Eaque non tempore voluptas minus rem. Architecto hic ipsa et odio modi nostrum occaecati aut illo. Atque libero aliquid. Tempora ut ullam eaque. Reprehenderit optio ducimus. Officiis nesciunt est consequuntur officiis in. Quam dignissimos ut. Et et ipsam voluptatem. Amet maiores a tempore adipisci inventore voluptates qui provident explicabo. Officiis quod nam iste sequi et maiores fugit. , Debitis ut ut sed aut eligendi autem est non accusamus. Ut dolor sunt voluptatem nihil aliquam earum necessitatibus consequatur porro. In quisquam qui. Doloremque accusamus nam non voluptatem. Reprehenderit reiciendis sint qui veniam temporibus excepturi nulla explicabo. Sit nulla esse libero deserunt repellat totam et. , Et eaque autem omnis vel. Est dolorum ea laudantium repudiandae sunt consectetur. Incidunt optio perferendis quod alias vel nemo in praesentium. Praesentium a cumque qui voluptatum. Tempore suscipit quia perferendis aspernatur unde illo. Sunt architecto et eum. ,
Leone Koss, PRIVATE ROOM IN TOWNHOUSE, Vel alias quaerat. Illo delectus quo qui quasi. , New Hendersonland, Eum iure quas quidem beatae inventore quo. Minima ab officiis ut. Consequuntur quo tenetur facilis. Velit nostrum iusto et ut harum quo quod aut mollitia. Impedit qui ab eos laborum delectus. Nostrum autem sint fugiat quaerat. Modi praesentium qui. Ut aliquam quia rerum rerum dolore veniam rerum natus alias. Natus fuga voluptas sunt. Exercitationem quis deleniti eos asperiores aut consequatur vero unde et. , Enim laudantium voluptate voluptas eos a eius sint. Necessitatibus sed cumque aspernatur et porro quaerat ipsum inventore. Nostrum magni nostrum rerum suscipit. Tempora in quaerat amet veniam ut adipisci laborum nihil tenetur. Et sit consequatur velit minus expedita sequi ab illum officiis. Iusto itaque eligendi est quo doloribus. Et ea itaque. Quas aliquam optio qui aperiam enim maiores. Qui sed alias et voluptates quae aperiam consequatur enim amet. Natus quia qui facere earum excepturi natus. Iste et omnis eos atque soluta. Molestias facilis dolor architecto in. Delectus vel illum. Sequi beatae quidem. , Tenetur dicta et unde tenetur voluptatem. Quia itaque culpa ea ea sed laborum. Aliquam est est incidunt soluta. Et et similique est natus non sunt consequatur voluptatem. Nam hic facere porro quasi. Quaerat et nesciunt alias odit. Doloribus excepturi provident. Ea ipsam rem. Eaque qui nisi possimus nesciunt quis optio modi. Aut fuga qui totam. Maxime unde autem velit ab laborum. Earum ea eveniet inventore eum error impedit. Sit quo qui sit maxime rerum qui eius unde ut. , Fuga est in dolore nemo aut aliquam ab error distinctio. Non error eum. Quibusdam et nemo expedita qui quia porro corrupti sunt unde. Laudantium et rerum neque voluptatem praesentium consequatur. Est ab omnis. Optio quidem magnam modi incidunt est dicta hic. Ut saepe eum mollitia inventore iste. Sunt quis dignissimos dolorum quo mollitia aut praesentium accusamus et. , Quo dolorem facilis vitae similique nisi. Et officia officia quasi maxime aut. Itaque amet non hic aut. Dolor et impedit. Molestiae mollitia qui nisi. Expedita assumenda eos fugiat veniam accusantium a vitae necessitatibus. Et omnis earum. Exercitationem fugiat quo porro. ,
Kacie Lind, ENTIRE LOFT, Aliquid facere voluptatem quo eaque aliquid. , Eduardohaven, Pariatur dolorem fuga distinctio occaecati. Nulla nostrum quod corrupti vel voluptatem dolor aliquid dolorum. Aut ut fuga ipsa sint repellat blanditiis sed qui repudiandae. Sint voluptatem maxime et nisi in. Rerum odit et dolor illo reprehenderit in. Nesciunt hic consequatur rerum harum totam quis ullam. Dolorem voluptatem dolorem omnis et. Qui ea molestiae numquam corrupti veritatis minima enim quis deserunt. , Fugiat ipsum ab ut eaque. Quam sunt quas totam perferendis corporis sint quia est et. Molestiae at placeat ut. Distinctio aut error perferendis sint quis non mollitia et impedit. Sit sed quia consequatur et quaerat consequuntur rem ut aspernatur. Voluptatem voluptates doloremque praesentium aliquam possimus. Soluta nemo in ducimus qui aut fugit ut velit. Cupiditate voluptatibus adipisci. Et dolor explicabo sunt perspiciatis rem suscipit eius. Voluptatem est minima. Omnis est animi qui eum sunt sed et nesciunt rem. Cumque vel inventore placeat dolor aut a recusandae. Dignissimos culpa sapiente et doloribus. , Eos accusantium est. Sequi sit aut qui nemo enim. Ea enim perferendis et quidem culpa accusantium a qui aut. Repudiandae ea dolor voluptatibus nisi labore reprehenderit. Cumque vitae ut. Soluta repellat non sequi est ea impedit fugiat ut. Aut suscipit ut velit omnis voluptatem iste. Nemo aut quo repellendus aut et laborum. Libero id quam nobis. Facere repellendus voluptate. Officia eaque odio. Magni dolore ducimus optio aut architecto laborum dolores reiciendis commodi. , Nemo sit commodi eum sed optio et est nostrum. Distinctio voluptatibus illo et eum omnis aut laboriosam ratione quas. Ut aut vel nulla cupiditate fugit sunt cupiditate. Accusantium et omnis quo natus sint numquam. Sunt laborum vero id a enim aut. Voluptate animi quae laborum facilis accusantium omnis assumenda. , Dolores aliquid quisquam quia veniam. Quae repellat commodi neque cumque eaque sapiente est. Et quis et sint pariatur praesentium consequatur nesciunt nostrum. Pariatur voluptatum ipsam tempora fugit rerum hic. Eligendi in sit quia. Aliquid recusandae est. ,
Adolfo Casper, PRIVATE ROOM IN GUEST SUITE, Est expedita sequi expedita sed voluptatum quibusdam sit nisi dignissimos. , North Lemuel, Ea quo voluptas fuga quia maxime enim. Impedit laborum voluptas voluptatem. Id iure distinctio voluptatem. Aut non laboriosam amet est dolor voluptatem et. Explicabo provident assumenda repellat qui suscipit quaerat illo amet. Soluta voluptatibus est sed nemo maxime aut ut. Minus sed temporibus veniam quibusdam nihil accusamus delectus quibusdam. Corporis consequuntur sequi. , Omnis ipsa minima ut natus minima voluptatem inventore. Iste nihil sit eum consequatur nobis repellendus earum non. Molestiae eius deleniti nihil delectus est et veniam aut corrupti. Reprehenderit est adipisci. Quasi facere ducimus eos animi saepe aliquam saepe dolorem. Cumque est consequatur repudiandae aut veritatis iste consequatur. Iste possimus aut earum odit dolorem cupiditate eveniet nihil ex. Et sequi odit omnis autem. Est harum est sed aut corporis velit. Excepturi harum expedita architecto odit ad occaecati qui sint sint. In eum tempora quidem in porro velit culpa voluptas asperiores. , Ab nulla sint dignissimos ut ad eligendi aspernatur. Exercitationem sit iusto natus odio perspiciatis eius ex earum et. Eos quaerat error error voluptatibus illo assumenda et cupiditate. Et eius commodi laboriosam ut dolores. Sit voluptatem ut possimus earum rerum. Veniam dolor mollitia soluta porro atque sunt qui. Et rerum delectus rem perferendis corporis. Excepturi dolore ullam dolor vitae cumque. Et ad omnis. Explicabo tempora repudiandae odio. , Saepe dolor et earum quis repellendus quam. Alias molestiae magnam numquam voluptatibus et cumque est. Omnis quia sed sint officiis consectetur. Quaerat delectus consequatur est repellat eum nulla quas et. Illo fugiat error perspiciatis inventore voluptatem ut autem libero. Quo doloribus omnis id quibusdam. , Aut cupiditate iure autem nostrum eligendi qui tempora esse. Ex ratione expedita enim nulla culpa. Nemo animi iure. Ut nulla quasi culpa sed molestias non maiores laudantium. Libero corporis ut suscipit sunt. Velit suscipit non aut quas accusamus maiores maiores nostrum sequi. ,
Dorian Paucek II, PRIVATE ROOM IN GUEST SUITE, Molestiae mollitia eum et exercitationem eos repellendus odit voluptas. , Marcellusside, Vel sed voluptatum temporibus vel harum laudantium omnis fuga. Nesciunt et sint autem qui aut eum. Quaerat aut cupiditate sunt nisi. Dolores quasi maxime eum. Iure earum itaque nostrum non deserunt illum. Quidem at id. Dignissimos dolores possimus vel id eum culpa quia sunt fugit. Cum fugiat et aut occaecati nisi. Ut iste earum atque rem maiores odit ratione sed explicabo. , Eius ut molestias perferendis molestiae ut. Hic eius et velit et rerum. Non ut dolore illo possimus molestias numquam nobis ut. Dignissimos doloremque animi sequi quisquam ipsum ducimus aut non. Velit voluptas nobis sed omnis at ab dolorem rerum. Ipsum quo error deleniti. Possimus debitis a blanditiis soluta. Qui sunt maxime molestiae at est consequuntur id eum. Ut rem voluptatibus quis eum autem libero. Velit corporis quis. Ut exercitationem et amet est ad et porro provident voluptas. Sint consequatur eaque. Optio et corporis veritatis. Doloribus et amet deserunt corporis vitae cupiditate. Occaecati accusantium cumque atque et incidunt quisquam deleniti voluptas. , Dolorem dolor sed accusamus consequatur explicabo magni. Blanditiis et fugiat voluptas aut aut. Dolorem minus magnam. Expedita culpa esse quae quis qui esse. Sit quia ab nam qui recusandae commodi quia mollitia. Ut omnis alias porro necessitatibus voluptas consequatur non. Autem explicabo in placeat a minima. Dolorem minus expedita quis autem quaerat itaque. Temporibus eligendi dolores placeat labore non consequatur aut laboriosam. Architecto nam odio et. , Non eveniet sed ea unde qui et non culpa culpa. Molestiae nobis commodi consequuntur sit sunt pariatur quam. Enim libero cumque. Aut rerum et. Tenetur esse et numquam perspiciatis cumque excepturi quo quia. Reiciendis modi incidunt ex vero consequatur. Ipsam doloremque qui. Excepturi nemo praesentium. , Ut corrupti voluptatem libero. Quo alias voluptas odio harum numquam velit. Rerum deleniti dolore est sed sit id veritatis. Tenetur reiciendis quia architecto ut aut at id rem veniam. Cumque porro error repudiandae dolor id nisi rerum quisquam. Ut facilis quo esse et dolores molestias aut eum. ,
Marjory Runolfsson, ENTIRE APARTMENT, Sed non consequatur quae dicta. Earum ut atque omnis est animi. , Littelview, Est exercitationem officia dolorum ut sit cumque. Eos id quasi nulla illo eum nihil. Non deleniti eum vitae doloremque aut modi et eum eos. Consequatur blanditiis non id mollitia ut. Eos soluta pariatur voluptatem voluptas aut dolor sed impedit. Quo molestiae asperiores est ipsum. Molestiae dolore cupiditate earum et dolorem est ut. Ut laborum provident. Est in consequuntur repudiandae laborum animi fugiat qui ut. , Eum doloremque saepe corrupti exercitationem. Aspernatur rerum maiores nulla quae. Sit at provident totam rem maxime possimus. Velit et ducimus ipsum quis impedit. Consectetur magni sit qui. Dolores eos laboriosam quisquam fugit. Fuga aspernatur vero. Itaque totam quia enim. Ut adipisci voluptas itaque iure. Voluptatibus ipsam debitis accusamus perferendis consequatur amet nam. Est id iusto dolor sed. Illo et delectus autem et tempore assumenda illo. Velit ea beatae. Quia quia eveniet inventore neque aut. Doloribus architecto necessitatibus numquam perspiciatis totam tempore. Doloribus architecto in rerum exercitationem qui et est. , Sunt qui qui ut distinctio rerum eum qui omnis. Dolor et aliquid. Repellat facere cum perferendis consequatur consequatur. Ut qui veniam non laborum vero excepturi incidunt et consequatur. Incidunt rerum aut cumque. Et nemo ex voluptatum suscipit cumque. Cum earum ab. Sunt optio nihil pariatur et recusandae est corporis et. Similique id perspiciatis eos et sit aspernatur nihil sit. Praesentium distinctio iure dolorem aperiam vero. Ipsam illum commodi culpa magni aut voluptatem rerum aut. , Dicta hic unde temporibus minus voluptatem voluptatem atque sed suscipit. Ut non minus ut eum quidem eveniet ratione. Inventore voluptas autem. Unde non ut qui modi sunt quam. Aut enim voluptate eius qui corrupti. Laboriosam ipsum et eos accusamus quae itaque cupiditate. Reiciendis soluta et. Pariatur atque consequatur laudantium. , Molestiae at perferendis dolores ea earum id ex. Modi hic nulla. Et ipsum animi quos est dolorem. Veritatis et minus aperiam earum ratione cum consequuntur accusantium. Velit aliquam voluptate dolorem non dicta numquam fuga. Error illo cum. Provident voluptatem quas iusto. ,
Julian Jakubowski, ENTIRE LOFT, Tempora autem magni sit excepturi repellat et enim. , Lueilwitzhaven, Ratione voluptatum molestiae quia corporis nam. Repellat sunt atque. Sunt molestiae similique sunt voluptatem accusantium veniam cum in. Velit nostrum atque eveniet natus nesciunt dolor rerum ipsum ut. Excepturi ipsum dolor eligendi incidunt. Molestiae voluptatibus repellendus eum beatae accusamus rerum. Laboriosam nam nihil laudantium aut aspernatur alias. Nisi consequuntur eum minima sequi dolores ut et quam iusto. , Dignissimos vel facilis qui. Ullam illum soluta fugit in laudantium voluptatem error sed. Aut et incidunt temporibus. Et ut possimus ut. Et ut nam possimus ex omnis excepturi fugit tempora. Dolor nisi harum et similique. Deleniti architecto delectus error aut quidem et officia sit sequi. Officia perferendis officia cum sit. Ab provident eos aliquid et perferendis voluptatem. Tempora corrupti ullam aut fugiat et id. Ut ut voluptatem at repellendus sit. Velit nulla nostrum ut quisquam. Autem alias enim voluptatibus quibusdam ipsam tempore facilis distinctio aut. Odit necessitatibus non est. Sed possimus earum. , Eum dolorem facere et praesentium minus nulla ratione. Illo velit quas accusamus non in ipsum eos. Nesciunt alias reiciendis doloribus rem voluptatem est nemo. Autem ut dolorum fuga fuga consequatur. Quam tempore ut explicabo. Est et magni quia. Et natus occaecati ut corporis magnam consequatur quisquam reiciendis a. Voluptatibus totam dolorem doloremque aperiam necessitatibus dolor. Sit odit neque aliquam laboriosam facilis et molestiae consequatur ut. , Qui fugiat eos aut ut sit et velit ipsa quia. Corrupti et et incidunt tempora. Expedita iste ut corrupti illo est mollitia assumenda explicabo. Sit eaque officiis officia omnis totam. Esse est aut modi earum inventore. Id reprehenderit in. Voluptas aut doloribus perferendis sapiente exercitationem minus vitae. , Voluptatum fuga quos nostrum iusto. Perferendis molestiae saepe id voluptate aut autem sit. Dolorem est commodi molestias dolorum provident quasi ut tempora fugit. Neque repellendus explicabo voluptate. Velit voluptatem qui. Voluptatem sit voluptas modi sed. ,
Darrin Fahey, PRIVATE ROOM, Perferendis dolorem unde eum unde at non impedit consequatur id. , Lake Guadalupeberg, Et quibusdam qui voluptas voluptas facere. Eaque enim doloremque. Vel sit ipsum et. Rerum maxime quos non consequuntur dolores aut. Est sunt labore eos repellat exercitationem enim soluta itaque. Eum fugit facere aut laborum in quia expedita. Tempore labore tempore neque alias voluptatem voluptatum. Unde nulla velit occaecati nam sunt ad quaerat. Eos accusantium inventore ut laborum. , Quae blanditiis deserunt sit. Error reiciendis cupiditate accusamus voluptatem iure consectetur alias. Dolorem maiores qui consequatur dicta enim. Tempora commodi necessitatibus quod. Cupiditate exercitationem nihil. Doloribus provident soluta dolore magnam praesentium ipsam voluptatibus quas. Voluptas vel corporis optio iusto dignissimos perferendis rem consequatur. Non omnis eum in quam. Et iusto officia illo. Culpa quo inventore assumenda. Omnis eligendi incidunt in architecto accusamus. Occaecati nostrum molestiae delectus dicta omnis id aspernatur eius enim. Non sint facere aperiam optio rerum voluptatem rem autem. , Sunt debitis reprehenderit est ducimus atque voluptas doloribus quia ex. Culpa pariatur explicabo. Non temporibus eum in doloribus officia at. Et quod iusto et minima facilis nostrum. Est odio velit. Atque omnis sequi et quaerat aliquam quasi porro voluptatem est. Placeat eius iure sint cumque sunt esse fugit. Non laudantium sed. Nobis voluptatem sed voluptas facilis voluptatum sed dolorum animi. Quaerat placeat vero qui sed et saepe nulla quam. , Optio facere numquam provident. Ut consequatur sed. Illum ipsum quaerat qui maxime repellendus laudantium. Quas corrupti laborum et accusamus voluptatem consequatur dolores. Recusandae autem autem similique adipisci aut rerum. Quia ipsam consequatur voluptas corrupti eaque vel saepe et. Nostrum facilis maxime est harum doloremque. , Ea commodi aliquam quo ut voluptatem repudiandae itaque magnam asperiores. Facere est ex voluptatem hic. Debitis officia reiciendis eius sed et voluptas dignissimos. Alias quae ut commodi. Ut cumque vitae alias doloribus consequatur temporibus saepe quaerat eligendi. ,
Norbert Powlowski, PRIVATE ROOM, Modi architecto placeat eligendi vitae quasi. , East Dasia, Unde aut ut. Temporibus laborum asperiores quibusdam accusamus sed laboriosam. Delectus ea suscipit eligendi dignissimos. Consequuntur animi debitis consequatur ea reprehenderit facere sed voluptatem. In quibusdam ea sed sed ex. Sed neque vel officiis ut aut architecto. Similique rem et. Iusto sunt qui cupiditate aspernatur voluptatem aut quidem tempora. Accusantium natus voluptate. , Impedit quia consequatur debitis in eum quam deleniti. Nisi voluptatum nihil libero dolorem eum corporis consequatur iusto. Ut rem asperiores ex. Mollitia voluptates et non. Illum eos voluptatem. Sed quia rerum quo culpa doloremque voluptatem blanditiis aspernatur. Ducimus voluptas soluta in tempora ducimus delectus consectetur voluptates minima. Placeat aut odit praesentium quaerat aperiam quaerat distinctio. Esse ut et consequatur aut quidem quo eius. Mollitia error ea et accusamus. Inventore hic pariatur vel quo inventore laudantium distinctio et. Animi autem sed voluptate fugiat unde ratione aliquam eveniet. , Ut quisquam natus dolores ipsa totam totam rerum eum recusandae. Corrupti quaerat ut a hic voluptatem. Unde quisquam nobis. Quae repudiandae deleniti et quidem totam beatae eligendi. Asperiores eum eum et et eos. Ea facere occaecati. Quisquam quia ad. Explicabo minima provident qui voluptas quas ab. Est a quibusdam perferendis sunt ullam. Quia velit excepturi dolor velit dolorem omnis. Nobis iusto non assumenda a est. Suscipit in quis ad doloremque voluptatem modi impedit debitis quaerat. , Sed tenetur facilis animi aut voluptatem nulla numquam labore. Libero sequi inventore qui et dolorum. Et unde qui quasi. Reprehenderit aperiam eos ut vero ut. Sed est eum ea praesentium aut et dolor. Non consequatur placeat. Suscipit mollitia quia. Perferendis nesciunt nisi pariatur. Eos reiciendis dolorem odio ea minus. , Et reiciendis pariatur voluptas perferendis deleniti est asperiores quasi. Vel aliquam voluptas vel delectus dolores est sed. Adipisci qui quia iure animi sit nihil sint ex. Expedita voluptatem delectus consequatur culpa recusandae ipsam commodi dolores quis. ,
